rating_id,user_id,movie_id,rating_score,rating_date,review_text,created_at
448,80,584,5,2024-02-17 15:23:57,Congress food yet economy deep move attack something money hit executive message.,2024-02-17 15:23:57
449,799,28,4,2025-07-16 02:56:44,Force choice dinner outside fine no try yourself believe they understand for.,2025-07-16 02:56:44
450,67,577,5,2025-08-12 15:29:25,Best huge drug need contain entire much very development situation close wind sea.,2025-08-12 15:29:25
451,146,207,2,2024-02-25 10:18:30,Professor his they any left news travel real old reveal rule recently.,2024-02-25 10:18:30
452,164,130,4,2024-11-10 16:11:50,A walk law head theory security discussion represent subject modern paper decision.,2024-11-10 16:11:50
453,272,549,1,2024-08-29 13:20:09,Town majority field real capital blue minute something particularly.,2024-08-29 13:20:09
454,274,46,3,2024-06-19 20:40:24,Likely various TV authority window century say.,2024-06-19 20:40:24
455,40,536,2,2025-07-16 13:02:27,Single produce light tough government much white only development family cold.,2025-07-16 13:02:27
456,504,185,5,2024-06-28 18:44:24,Under organization sell stuff successful action skill full clearly forget nation section.,2024-06-28 18:44:24
457,360,141,3,2024-09-02 14:41:35,Back interesting to ask nearly have black case despite.,2024-09-02 14:41:35
458,290,552,1,2024-04-03 05:12:35,Technology thought throw social project country station camera kitchen main activity summer.,2024-04-03 05:12:35
459,977,553,2,2024-12-10 00:39:15,Term record garden wrong similar truth discover may great most nothing lawyer.,2024-12-10 00:39:15
460,442,535,1,2025-03-02 05:59:41,No after thank party benefit system cup cause would.,2025-03-02 05:59:41
461,737,280,4,2025-06-22 03:08:24,Put western deal property thought not worker million under agreement tonight view strategy.,2025-06-22 03:08:24
462,718,96,4,2025-02-11 15:18:22,Remember of the let able make several mission happy.,2025-02-11 15:18:22
463,779,442,4,2024-11-18 20:57:06,Seat blood notice I see relationship.,2024-11-18 20:57:06
464,751,311,4,2025-08-08 02:43:06,Address call size arm economy evidence build minute include window.,2025-08-08 02:43:06
465,379,362,5,2024-02-17 20:09:29,Whole computer play office tree black church north collection.,2024-02-17 20:09:29
466,366,439,2,2025-05-23 04:56:13,Else return man mind everyone audience line.,2025-05-23 04:56:13
467,445,226,5,2024-05-29 03:25:16,Apply trouble matter event middle generation.,2024-05-29 03:25:16
468,576,187,5,2024-05-24 04:46:34,Now physical type matter station reach.,2024-05-24 04:46:34
469,959,561,5,2024-08-03 06:39:21,Join card tough radio must teach effort whole care prevent.,2024-08-03 06:39:21
470,7,551,3,2024-07-21 06:16:26,Customer major guy certain culture instead.,2024-07-21 06:16:26
471,307,263,1,2024-07-26 00:37:20,Turn party dark discuss would between sort knowledge yard attention federal.,2024-07-26 00:37:20
472,292,398,3,2025-04-01 03:36:19,Else hair those theory amount work cold cultural maintain nation could.,2025-04-01 03:36:19
473,949,299,3,2024-11-16 04:28:09,One bring line message produce foreign list produce.,2024-11-16 04:28:09
474,430,526,4,2024-10-15 22:58:13,Edge serve order something enjoy billion if easy force lose discussion defense.,2024-10-15 22:58:13
475,823,181,2,2024-07-21 07:24:31,Within chance develop case wind believe wear.,2024-07-21 07:24:31
476,973,28,2,2025-08-05 22:44:15,Material outside citizen expert week often billion onto evidence.,2025-08-05 22:44:15
477,236,290,2,2024-05-11 07:04:11,Form beyond effect along car house degree reality catch food your accept back.,2024-05-11 07:04:11
478,392,27,2,2024-05-31 15:41:48,Head such agreement lay believe speak any lot account decade between.,2024-05-31 15:41:48
479,316,266,5,2024-09-21 15:35:55,Must physical I last accept suggest step option himself still share can maintain.,2024-09-21 15:35:55
480,600,225,3,2024-11-05 08:19:06,News traditional degree space energy development world compare because car director indeed former.,2024-11-05 08:19:06
481,840,94,1,2025-06-19 04:03:51,Result improve short operation campaign record director.,2025-06-19 04:03:51
482,708,294,1,2024-03-06 20:18:14,Newspaper value claim scene really he nothing throughout material at reduce order.,2024-03-06 20:18:14
483,182,376,4,2025-09-06 07:28:35,Cover my despite different house more either relate consumer what bit often turn.,2025-09-06 07:28:35
484,689,4,5,2024-06-30 03:00:38,These skin cup environmental financial recently wife.,2024-06-30 03:00:38
485,404,572,1,2024-10-17 18:48:03,More building hand claim hope benefit.,2024-10-17 18:48:03
486,193,234,3,2024-02-09 11:51:14,Power huge challenge military issue begin south dog test resource state certain.,2024-02-09 11:51:14
487,131,185,4,2025-04-28 04:04:19,This risk our few under it of occur shake hard sport religious nor.,2025-04-28 04:04:19
488,890,579,1,2025-04-24 00:08:15,Along every sea leader likely second.,2025-04-24 00:08:15
489,830,439,3,2025-04-23 10:11:27,Study role far measure hospital upon brother court.,2025-04-23 10:11:27
490,280,255,2,2025-06-23 08:18:15,Structure most magazine ahead science memory should arrive consider total brother middle.,2025-06-23 08:18:15
491,645,323,4,2025-05-20 17:52:19,Them dream water point close well myself surface practice of rock.,2025-05-20 17:52:19
492,231,266,5,2024-06-17 11:11:39,Early a so Republican lawyer vote explain wide perform while author.,2024-06-17 11:11:39
493,578,158,3,2024-06-27 15:05:04,Phone mission place hand month happen game record improve culture.,2024-06-27 15:05:04
494,199,471,3,2025-06-19 12:42:52,Law per amount generation eat add.,2025-06-19 12:42:52
495,587,489,2,2024-12-15 12:30:41,Rock walk watch song price land.,2024-12-15 12:30:41
496,580,437,4,2025-01-05 21:33:40,President certainly democratic factor hit city exist network customer foreign page.,2025-01-05 21:33:40
497,333,188,4,2024-10-19 05:26:35,Particularly never approach hit owner smile.,2024-10-19 05:26:35
498,276,60,2,2025-03-13 05:15:16,Senior listen himself mother he clearly service teach performance even watch.,2025-03-13 05:15:16
499,702,324,5,2024-07-26 05:43:32,Bit itself paper cut yet challenge garden key stock series anyone.,2024-07-26 05:43:32
500,417,111,1,2025-03-13 11:36:08,Themselves woman century strategy performance type.,2025-03-13 11:36:08
501,570,150,1,2025-08-09 01:41:48,Suddenly computer because group garden deal with medical.,2025-08-09 01:41:48
502,930,94,5,2024-05-30 22:01:19,National third red reach model ask son design question class.,2024-05-30 22:01:19
503,833,145,3,2024-10-31 04:31:10,Risk any product produce event agent anyone century.,2024-10-31 04:31:10
504,31,400,4,2025-09-11 08:54:44,Four realize do record near raise carry a success.,2025-09-11 08:54:44
505,54,242,2,2024-12-04 09:40:37,Trouble price drop worker join feel.,2024-12-04 09:40:37
506,106,404,2,2024-03-09 03:01:00,Near enough animal PM yard person hit eight discuss station control report table.,2024-03-09 03:01:00
507,212,175,3,2024-07-27 16:17:16,Phone parent physical leave citizen long sea.,2024-07-27 16:17:16
508,383,209,3,2024-07-01 15:59:38,Cell product friend more although I four own among much form focus.,2024-07-01 15:59:38
509,291,277,5,2024-11-19 09:01:50,Never thousand meeting just large tough treatment enjoy contain whom across management reality.,2024-11-19 09:01:50
510,973,219,1,2024-09-10 03:46:24,While goal buy student myself according rock themselves some lay both game impact drug.,2024-09-10 03:46:24
511,859,359,1,2025-05-23 20:33:43,Nation expect affect physical east body.,2025-05-23 20:33:43
512,129,112,3,2024-10-30 20:35:38,Present home job police moment out.,2024-10-30 20:35:38
513,559,310,5,2024-10-22 23:41:39,Raise race traditional consider window state choose none.,2024-10-22 23:41:39
514,911,59,2,2024-05-15 12:00:08,He law discover member step through line treat.,2024-05-15 12:00:08
515,230,366,2,2024-07-01 16:55:43,Establish record rest dark truth agent necessary activity amount through conference.,2024-07-01 16:55:43
516,149,163,5,2025-08-28 20:35:32,Near media reason cup machine standard.,2025-08-28 20:35:32
517,276,41,3,2025-06-03 04:47:41,Positive outside travel exist yard throw group worker level blood Congress far.,2025-06-03 04:47:41
518,540,249,2,2024-05-15 12:05:05,Accept us suffer where expert to up computer consumer move.,2024-05-15 12:05:05
519,624,320,4,2025-01-21 23:23:37,Pm home drug dog social thought unit during attention.,2025-01-21 23:23:37
520,40,568,5,2024-03-14 06:06:58,Wait itself show writer interest high next successful.,2024-03-14 06:06:58
521,843,361,1,2024-03-11 06:08:13,Another southern vote describe wife never sound research wear detail PM born.,2024-03-11 06:08:13
522,498,247,5,2025-06-19 08:35:53,Attorney cold eye have those set according girl focus board.,2025-06-19 08:35:53
523,197,284,5,2024-05-27 07:25:39,Our about nation assume air summer mouth oil sort describe still mention security.,2024-05-27 07:25:39
524,185,380,3,2024-09-21 12:58:35,Prevent own skin pay after approach national score treatment.,2024-09-21 12:58:35
525,683,557,2,2024-05-26 04:04:43,Republican us car team walk land.,2024-05-26 04:04:43
526,614,143,1,2024-06-12 07:41:28,Pressure try continue drug option late now thing north card me situation then.,2024-06-12 07:41:28
527,901,151,3,2025-08-03 03:33:55,But low of specific career speak prepare degree weight least image set go happy.,2025-08-03 03:33:55
528,522,593,4,2024-06-02 09:05:39,Pattern condition might news simple they forget.,2024-06-02 09:05:39
529,881,21,3,2024-08-18 08:26:49,Similar hope front modern at notice difference top a.,2024-08-18 08:26:49
530,758,443,4,2025-08-15 22:29:14,Road last yourself side green together house wish major candidate civil.,2025-08-15 22:29:14
531,854,19,3,2024-10-10 02:06:53,Choice ask which in use industry reality help discover any.,2024-10-10 02:06:53
532,546,581,5,2024-02-09 05:48:29,Another measure from region society tree there radio rule successful.,2024-02-09 05:48:29
533,815,193,5,2024-01-12 01:55:26,Small with wear any between agree feeling do box.,2024-01-12 01:55:26
534,578,473,2,2024-03-16 00:54:32,Few recent this our stay result already seem high agency.,2024-03-16 00:54:32
535,295,151,4,2025-06-14 23:28:55,Look pick mission door effort food consumer nature.,2025-06-14 23:28:55
536,829,341,5,2025-04-13 21:34:21,Bag source including heart matter plant over your mean police maybe cup.,2025-04-13 21:34:21
537,757,93,1,2025-02-24 15:38:21,Six deep on relate after sell theory loss president save once.,2025-02-24 15:38:21
538,581,346,4,2024-02-03 10:47:14,Nature truth thank police thousand painting response now politics benefit short relate.,2024-02-03 10:47:14
539,198,261,5,2024-05-08 01:28:43,Town bed goal discussion television who kid.,2024-05-08 01:28:43
540,121,499,4,2024-12-18 10:07:18,Find position ago interesting but report beautiful thus help local may purpose.,2024-12-18 10:07:18
541,623,280,1,2024-03-22 14:28:17,Reflect after matter recent box strong sound determine real standard treatment born sing.,2024-03-22 14:28:17
542,186,457,3,2024-01-21 06:33:23,Past month thousand scientist study a choice card like measure space consider.,2024-01-21 06:33:23
543,349,28,2,2024-11-29 12:35:50,Professor executive security name woman cause myself brother many eat candidate defense grow.,2024-11-29 12:35:50
544,532,329,4,2024-03-23 05:23:40,First base recognize street right next late face where model.,2024-03-23 05:23:40
545,601,541,1,2025-08-03 07:51:39,Some court recent policy because wife realize tough watch truth life leave.,2025-08-03 07:51:39
546,790,171,3,2024-01-14 20:27:24,Interesting little apply soon game best threat among.,2024-01-14 20:27:24
547,285,345,5,2024-11-17 04:26:44,Door phone nearly condition catch maybe market response class player.,2024-11-17 04:26:44
548,332,343,3,2024-09-21 16:31:48,Candidate whatever myself all hot pay.,2024-09-21 16:31:48
549,180,158,5,2025-05-08 07:06:37,Own decide past claim born early because phone plant painting interest.,2025-05-08 07:06:37
550,693,230,3,2024-12-20 04:14:14,Page no activity guess official use exactly bag sense if purpose why care.,2024-12-20 04:14:14
551,971,163,5,2025-03-03 03:01:28,Them though civil can popular author case you.,2025-03-03 03:01:28
552,635,390,4,2024-01-13 11:05:07,Like main blue out you try relate no when.,2024-01-13 11:05:07
553,91,184,4,2024-08-03 09:30:46,Room from already good big food edge choose woman plant.,2024-08-03 09:30:46
554,530,150,1,2024-11-07 05:31:40,Work least realize serve police our leg soldier nature thousand lot if able side.,2024-11-07 05:31:40
555,119,28,4,2024-04-06 17:04:47,True center born service wind carry.,2024-04-06 17:04:47
556,858,303,5,2024-05-29 04:17:00,Weight huge down along general boy drug evidence knowledge person in president minute.,2024-05-29 04:17:00
557,29,108,2,2024-06-27 06:14:40,Man add fall air cold fund cover part serve especially century edge.,2024-06-27 06:14:40
558,91,499,5,2024-06-25 09:30:04,Bring through look store reflect reveal compare along blue no game discuss oil.,2024-06-25 09:30:04
559,29,244,2,2025-06-14 16:14:07,Care live indeed make time bit man exactly indeed brother since eat.,2025-06-14 16:14:07
560,739,574,5,2024-01-04 06:06:54,Send join grow age about situation much bed tonight ever care anyone generation.,2024-01-04 06:06:54
561,782,67,2,2025-01-15 03:21:14,Factor save happen realize fine around whom with occur now knowledge space pressure.,2025-01-15 03:21:14
562,691,230,3,2025-08-03 09:54:26,Realize child claim trip model enough different face way challenge job gun specific.,2025-08-03 09:54:26
563,47,416,1,2024-10-07 12:36:22,Camera important including finally body political rest star job tell single station born.,2024-10-07 12:36:22
564,549,285,3,2025-08-08 08:16:49,Back best shoulder across skin list chair anything probably help.,2025-08-08 08:16:49
565,579,346,3,2025-08-14 02:13:45,Outside parent voice fund have sell start near those animal bit serve.,2025-08-14 02:13:45
566,929,18,2,2024-09-16 05:29:26,Risk than owner network four investment remain character air.,2024-09-16 05:29:26
567,796,449,5,2024-01-07 22:24:05,Husband without best will five top we stop.,2024-01-07 22:24:05
568,54,396,4,2024-04-22 01:12:55,Rate impact air class live each describe agree party drive.,2024-04-22 01:12:55
569,228,208,5,2024-06-30 11:05:23,Become during affect strong realize indeed.,2024-06-30 11:05:23
570,562,123,1,2025-08-19 13:11:36,Life skin local father should possible of.,2025-08-19 13:11:36
571,510,336,4,2025-06-29 07:53:03,Happen property old up trouble describe someone able wait couple issue race.,2025-06-29 07:53:03
572,161,331,4,2025-06-05 05:32:11,Big series audience well author room ground type enough contain source image.,2025-06-05 05:32:11
573,804,152,4,2025-04-10 20:58:00,Improve really if prepare anyone around far couple rest data exactly charge.,2025-04-10 20:58:00
574,164,491,4,2024-09-11 22:18:54,Network nice this reach just often vote glass soon.,2024-09-11 22:18:54
575,188,410,3,2024-03-19 17:41:45,Decade at along service push maintain building test candidate treatment yourself news soldier.,2024-03-19 17:41:45
576,882,362,5,2025-08-26 03:21:16,Teacher since sound today each crime test minute.,2025-08-26 03:21:16
577,566,308,5,2024-06-23 00:00:48,Man address significant movement we eight window position small mouth manager college raise.,2024-06-23 00:00:48
578,271,211,5,2025-05-21 00:03:46,Reason base walk easy staff how note join.,2025-05-21 00:03:46
579,317,479,2,2025-06-19 05:30:53,Reach area quickly want what professional name military world rich media blood.,2025-06-19 05:30:53
580,159,502,1,2024-01-20 13:25:43,Actually hospital term agency prepare improve city bank enter decade.,2024-01-20 13:25:43
581,863,356,3,2025-03-22 01:00:48,Suddenly while upon that worry paper day lot serve provide serve pull serve.,2025-03-22 01:00:48
582,221,24,4,2024-05-08 07:41:07,Leg low note across receive whose.,2024-05-08 07:41:07
583,630,207,3,2024-09-02 18:19:53,Our rest wrong far themselves minute sea.,2024-09-02 18:19:53
584,582,42,5,2024-02-06 19:43:22,Keep accept loss minute people wind believe ability beautiful.,2024-02-06 19:43:22
585,561,42,4,2025-05-29 04:50:07,Sort himself kind production beautiful career story let man seven power create voice.,2025-05-29 04:50:07
586,394,587,3,2025-08-01 12:28:27,Than nature discover fall floor structure trip.,2025-08-01 12:28:27
587,278,340,4,2025-05-01 18:49:22,Public vote chair type future direction Mr picture hair sister safe.,2025-05-01 18:49:22
588,748,240,1,2024-07-14 19:14:31,Project poor nation police major would character.,2024-07-14 19:14:31
589,151,120,3,2024-08-08 16:13:38,Indeed teach accept at successful name make without think bar good thus.,2024-08-08 16:13:38
590,346,98,3,2024-12-11 04:35:12,West yes dream three process quickly guy paper capital must poor.,2024-12-11 04:35:12
591,379,102,2,2024-05-09 06:46:34,Main shoulder art decide prove marriage.,2024-05-09 06:46:34
592,235,503,3,2025-01-08 20:38:18,Special method family strategy watch training article movement either than draw interesting.,2025-01-08 20:38:18
593,26,158,4,2024-08-05 18:25:55,Drug call type later near start why term heart face when as.,2024-08-05 18:25:55
594,856,546,3,2025-03-15 21:41:04,Light discussion language political structure or simple machine call student.,2025-03-15 21:41:04
595,92,565,3,2025-05-23 14:11:40,Act newspaper listen determine clearly able.,2025-05-23 14:11:40
596,412,383,2,2024-05-29 12:14:22,Fight simply manage newspaper image bar operation our.,2024-05-29 12:14:22
597,954,176,2,2025-02-26 08:01:47,Tax talk culture record clearly law well hard.,2025-02-26 08:01:47
598,940,221,2,2024-04-25 03:26:20,Serious director student surface move pattern small ok read agent reality bring wrong.,2024-04-25 03:26:20
599,201,121,4,2025-08-18 22:00:28,Happy look heavy study quite base but pressure expert.,2025-08-18 22:00:28
600,371,453,1,2024-04-07 02:40:14,Peace town shake they upon way look.,2024-04-07 02:40:14
601,313,302,2,2025-01-12 19:53:21,Different TV phone trip reality half art institution total election.,2025-01-12 19:53:21
602,670,494,1,2025-07-24 14:42:33,East central him our whose pay wife.,2025-07-24 14:42:33
603,613,588,5,2024-01-18 17:43:13,For soon word say the week actually talk blood position meeting and.,2024-01-18 17:43:13
604,460,484,2,2025-03-04 12:54:14,Group third miss defense understand case audience specific his.,2025-03-04 12:54:14
605,627,122,3,2024-06-26 00:43:08,They else back agency shake create approach Democrat control defense much article.,2024-06-26 00:43:08
606,288,477,5,2024-06-17 19:54:58,Threat special dinner approach trip operation institution catch already bed machine national energy.,2024-06-17 19:54:58
607,256,279,1,2024-01-22 22:24:28,Feel third wish there subject kitchen past huge have suffer.,2024-01-22 22:24:28
608,982,352,2,2024-01-20 16:23:31,Court memory response early close simply miss also several interest.,2024-01-20 16:23:31
609,744,271,4,2024-10-28 02:12:22,Social require rather choice building pull guess just happen want blue decade.,2024-10-28 02:12:22
610,176,264,4,2025-09-13 18:52:15,Customer stuff strong similar prepare artist gas fact system teach especially.,2025-09-13 18:52:15
611,658,425,3,2024-07-06 23:00:59,Some civil someone network wrong onto parent value step agent beautiful lead.,2024-07-06 23:00:59
612,145,498,4,2024-07-15 08:25:26,May debate firm could however magazine everyone ability.,2024-07-15 08:25:26
613,79,505,3,2025-02-13 09:51:43,Debate million pay color shake which well yeah level south.,2025-02-13 09:51:43
614,897,123,5,2024-01-14 22:45:31,Identify issue city person north cell important left chair week.,2024-01-14 22:45:31
615,887,181,5,2025-02-15 05:06:05,Address name sing as decide month candidate family usually hour black camera property.,2025-02-15 05:06:05
616,850,507,3,2024-08-01 19:50:28,Foreign general source yet visit wrong.,2024-08-01 19:50:28
617,667,189,3,2025-09-18 13:19:19,Range home budget occur president leg message just argue.,2025-09-18 13:19:19
618,282,522,3,2024-07-18 17:58:38,Enjoy evening Democrat food wife individual others billion.,2024-07-18 17:58:38
619,699,592,2,2025-02-15 04:21:20,Four assume response during nothing them finish region practice candidate feel.,2025-02-15 04:21:20
620,210,1,1,2025-06-28 05:30:03,Let thing Congress sign stop event behind middle.,2025-06-28 05:30:03
621,536,282,3,2025-08-10 18:39:38,Art place girl whatever term live with again push car weight cost.,2025-08-10 18:39:38
622,286,580,5,2025-05-04 00:31:34,Base into fine friend view little girl many party as.,2025-05-04 00:31:34
623,546,416,2,2024-10-05 11:16:56,Reflect network professional under option skill reality dinner.,2024-10-05 11:16:56
624,9,95,2,2024-05-08 01:27:05,Could resource help however pass moment response care us your lay.,2024-05-08 01:27:05
625,557,17,5,2025-09-10 06:00:01,Hope PM live maybe prevent let whatever.,2025-09-10 06:00:01
626,319,279,4,2024-02-15 12:26:48,Everybody stuff sea organization visit fact skill.,2024-02-15 12:26:48
627,471,120,5,2025-05-20 18:14:12,Shoulder build federal relate business space discover.,2025-05-20 18:14:12
628,183,448,4,2025-07-30 09:12:40,Author about your the close impact benefit reach office fine.,2025-07-30 09:12:40
629,670,100,2,2024-07-04 12:39:21,One can ok something local value challenge front follow speak.,2024-07-04 12:39:21
630,392,442,1,2025-05-17 08:41:23,Rate road military as marriage protect wind network develop foreign arrive control.,2025-05-17 08:41:23
631,574,519,4,2024-11-10 14:06:30,Sound source real security safe indicate will letter.,2024-11-10 14:06:30
632,774,284,2,2024-04-20 10:27:51,Pm cell Congress special film actually animal happen example team answer mean final.,2024-04-20 10:27:51
633,319,321,4,2024-02-03 17:26:08,Environmental audience responsibility new far police technology stage adult dinner.,2024-02-03 17:26:08
634,913,417,1,2024-01-31 15:45:26,Century high its build charge cold new rock say west such.,2024-01-31 15:45:26
635,50,71,3,2024-11-19 16:46:56,Condition stock travel community food leader.,2024-11-19 16:46:56
636,151,98,2,2025-09-14 15:38:07,Respond half both operation later parent mean product but mean.,2025-09-14 15:38:07
637,114,539,4,2025-01-12 21:27:04,Pretty entire team example big conference see cover.,2025-01-12 21:27:04
638,745,427,3,2024-05-29 23:09:22,My serve attention ahead from region offer crime natural experience.,2024-05-29 23:09:22
639,209,574,2,2025-08-17 20:30:25,Throughout at other play blood add no fear cup challenge low.,2025-08-17 20:30:25
640,579,205,2,2025-03-31 22:09:57,Special budget at room two know computer government thing.,2025-03-31 22:09:57
641,648,223,1,2024-09-28 02:13:06,Lead mean always education air throughout item necessary offer of first.,2024-09-28 02:13:06
642,364,102,4,2024-10-26 14:41:54,Brother future their large begin floor table.,2024-10-26 14:41:54
643,117,56,2,2024-10-11 18:06:49,After however time check prove hour card college writer.,2024-10-11 18:06:49
644,701,543,1,2024-03-06 20:49:14,Feel customer scientist manager fly our mother history.,2024-03-06 20:49:14
645,815,405,2,2025-06-01 07:11:35,Kid protect generation very lead last involve election teacher economic high much use institution.,2025-06-01 07:11:35
646,188,456,4,2024-03-26 14:15:09,Now you after spring maintain media be service white color itself lay.,2024-03-26 14:15:09
647,744,60,2,2025-01-13 04:48:24,Join task up set anyone plan clear really bank anything American.,2025-01-13 04:48:24
648,362,109,4,2024-03-16 19:22:07,Picture evidence defense open customer push.,2024-03-16 19:22:07
649,691,21,3,2024-09-08 20:26:05,Recently traditional writer politics job writer particularly color lay.,2024-09-08 20:26:05
650,912,72,2,2025-01-30 09:28:18,Beautiful group black several set customer practice high heavy music.,2025-01-30 09:28:18
651,137,131,4,2024-02-03 14:22:09,Media sign clearly bring medical however statement by may.,2024-02-03 14:22:09
652,565,458,1,2025-05-29 09:53:36,Civil individual out major only discuss provide visit especially ago treat law.,2025-05-29 09:53:36
653,925,489,1,2024-01-20 02:05:48,Local medical just stay should letter answer force concern your.,2024-01-20 02:05:48
654,899,1,5,2024-05-22 08:52:59,Analysis laugh free quality of role foot.,2024-05-22 08:52:59
655,313,303,1,2025-07-04 14:55:49,Either black analysis week data present.,2025-07-04 14:55:49
656,158,366,1,2025-04-24 18:33:05,Environmental individual country staff week through.,2025-04-24 18:33:05
657,658,479,4,2024-05-25 03:26:41,Build four clearly low energy college individual affect name feel open compare purpose.,2024-05-25 03:26:41
658,678,41,1,2024-05-29 18:51:19,Forward effect attack executive record significant many.,2024-05-29 18:51:19
659,340,306,3,2024-01-19 01:41:59,Executive appear possible television president firm available.,2024-01-19 01:41:59
660,184,545,2,2024-04-06 05:08:39,Somebody next situation describe into rate debate test life.,2024-04-06 05:08:39
661,586,301,1,2025-03-17 04:40:03,Black health official size painting bed reflect wonder various figure five west.,2025-03-17 04:40:03
662,852,199,1,2024-10-26 17:22:25,Dark parent class large say again training scientist owner less.,2024-10-26 17:22:25
663,518,535,5,2024-10-12 19:24:52,Edge among model very use wonder home help.,2024-10-12 19:24:52
664,712,342,1,2024-07-30 21:26:43,Range grow prepare environmental drug capital contain wonder the long father there.,2024-07-30 21:26:43
665,390,494,5,2025-08-26 10:05:22,Nation child American ball decade citizen the look form.,2025-08-26 10:05:22
