rating_id,user_id,movie_id,rating_score,rating_date,review_text,created_at
1542,641,107,3,2025-02-12 15:37:58,Here language those skin same likely ahead financial actually skin.,2025-02-12 15:37:58
1543,506,108,1,2025-04-03 02:05:52,Always girl poor item stage professor.,2025-04-03 02:05:52
1544,115,459,3,2024-02-12 03:15:51,Fly hold if often effort carry sport present so laugh market compare imagine.,2024-02-12 03:15:51
1545,196,49,3,2024-07-02 06:42:17,Treat research than as authority though weight behind.,2024-07-02 06:42:17
1546,136,102,3,2024-07-04 06:29:28,Owner hot heart despite spend president despite effect I animal someone difference.,2024-07-04 06:29:28
1547,79,260,3,2025-06-25 03:41:26,Every Republican shoulder may direction lawyer.,2025-06-25 03:41:26
1548,886,130,5,2025-01-11 06:39:07,Stop table agreement budget ability apply record technology produce cell everything down return.,2025-01-11 06:39:07
1549,538,258,2,2024-10-21 17:48:08,Maintain door stop mean wear his political big keep help north court against.,2024-10-21 17:48:08
1550,126,160,1,2025-01-17 04:22:25,Life deal program knowledge write cell product skill practice professor science.,2025-01-17 04:22:25
1551,663,550,3,2024-09-16 22:03:53,Impact which game guess onto stand front keep baby region yourself.,2024-09-16 22:03:53
1552,265,4,1,2025-06-06 21:17:39,Industry local chance tonight church machine relationship discover it guess parent area.,2025-06-06 21:17:39
1553,738,252,1,2024-08-13 11:15:41,Difference around song both approach generation.,2024-08-13 11:15:41
1554,572,174,5,2024-07-12 00:50:26,Improve cup plant hour do carry whom total rule.,2024-07-12 00:50:26
1555,191,511,1,2024-08-17 00:20:41,Maintain size from focus PM happen wide.,2024-08-17 00:20:41
1556,752,7,4,2024-11-12 17:59:21,Guy measure live parent subject put floor force.,2024-11-12 17:59:21
1557,620,242,3,2024-10-16 20:46:33,Front instead miss professional break home beat produce news.,2024-10-16 20:46:33
1558,736,577,2,2024-01-25 07:34:21,Rest college shoulder heart face white.,2024-01-25 07:34:21
1559,293,421,2,2025-05-08 00:06:45,Tax all prevent director surface participant official if especially.,2025-05-08 00:06:45
1560,270,52,1,2025-04-29 03:00:03,What various ability realize coach forget matter economic.,2025-04-29 03:00:03
1561,394,181,5,2024-01-10 10:19:15,Provide million whatever short program owner popular others collection hair affect defense.,2024-01-10 10:19:15
1562,592,64,4,2024-01-16 06:02:25,Director affect recognize Mrs remember walk article deal large condition minute today.,2024-01-16 06:02:25
1563,148,66,4,2024-09-20 04:32:58,Couple again hair join necessary image finally customer after customer feeling speak church.,2024-09-20 04:32:58
1564,75,106,4,2024-09-12 07:29:56,Force charge recently employee dream score recent box them treat method.,2024-09-12 07:29:56
1565,22,315,2,2025-06-22 08:51:24,Time better movement week chair age heart author thank.,2025-06-22 08:51:24
1566,858,4,4,2024-06-17 01:51:07,Pattern can north activity teacher without similar staff could message account the hear.,2024-06-17 01:51:07
1567,502,458,1,2025-04-24 11:26:22,Laugh garden from civil agency imagine several that design.,2025-04-24 11:26:22
1568,210,211,4,2024-10-01 14:36:15,Area others keep worker station call television soldier eye phone practice owner.,2024-10-01 14:36:15
1569,781,186,2,2024-12-29 15:13:47,Citizen deal who level arrive on just save positive scientist.,2024-12-29 15:13:47
1570,809,574,2,2025-01-01 05:26:18,Answer knowledge tree answer at pick.,2025-01-01 05:26:18
1571,579,250,5,2025-01-05 20:45:43,Whatever help message interest third success seven.,2025-01-05 20:45:43
1572,120,406,3,2024-11-09 22:00:06,Provide yeah window rich piece address fight name.,2024-11-09 22:00:06
1573,217,16,5,2025-05-14 23:59:33,Chance federal recent analysis education father figure.,2025-05-14 23:59:33
1574,824,413,2,2025-06-29 01:44:07,Scientist road anything much car market build throw find stand value with.,2025-06-29 01:44:07
1575,760,124,4,2024-08-24 02:30:38,Those writer success live grow fight seek our morning reason federal base sign.,2024-08-24 02:30:38
1576,350,547,2,2024-08-16 19:25:46,Around whether process then always tell.,2024-08-16 19:25:46
1577,780,512,4,2024-06-20 06:23:51,Use mother approach stock sure first and future charge.,2024-06-20 06:23:51
1578,666,163,2,2024-04-21 17:27:03,Necessary myself discover language save fear article development radio blue.,2024-04-21 17:27:03
1579,377,483,5,2024-12-21 08:23:38,Hear north computer election establish choose near between bit deep else.,2024-12-21 08:23:38
1580,444,329,1,2025-09-17 16:03:36,Only hot article friend experience she their movie.,2025-09-17 16:03:36
1581,536,451,3,2024-03-26 04:37:25,Sing hear official forward as around try establish product perform drug daughter growth.,2024-03-26 04:37:25
1582,285,401,1,2024-02-10 04:59:36,Perhaps include determine generation paper listen.,2024-02-10 04:59:36
1583,303,52,3,2024-02-25 04:52:23,Really claim protect attorney response real however car many as.,2024-02-25 04:52:23
1584,812,191,5,2024-04-07 01:53:50,Contain eye you traditional just standard quite guy blood set yes month side.,2024-04-07 01:53:50
1585,277,340,3,2025-06-03 22:49:18,Store set able spring here then measure especially campaign mention customer result.,2025-06-03 22:49:18
1586,799,77,5,2024-11-02 10:39:17,Fund without sport exist sit five same such.,2024-11-02 10:39:17
1587,842,201,1,2025-04-11 09:08:21,Season project summer century eight eat value blood you age many all.,2025-04-11 09:08:21
1588,438,331,5,2024-04-11 23:28:12,Drug so time build theory garden her perhaps enjoy thank cut however force.,2024-04-11 23:28:12
1589,749,106,4,2024-01-25 09:17:48,Look partner score market fly call statement term pull young owner civil probably.,2024-01-25 09:17:48
1590,813,356,5,2024-03-26 02:16:07,Ground nation protect ever bank hair wife while traditional than land or well.,2024-03-26 02:16:07
1591,461,562,1,2025-03-25 20:41:17,Financial dark instead instead identify laugh difference again fact.,2025-03-25 20:41:17
1592,742,278,1,2025-06-13 17:43:54,Future of knowledge note dream direction old man.,2025-06-13 17:43:54
1593,599,220,2,2024-07-07 20:05:09,People great Mrs here policy live.,2024-07-07 20:05:09
1594,707,206,2,2024-02-22 20:30:37,Near specific machine guess him cost campaign would response process great.,2024-02-22 20:30:37
1595,379,572,4,2025-01-22 16:04:13,Former our affect head three try message research.,2025-01-22 16:04:13
1596,660,452,5,2024-12-13 23:43:47,Author write sound night ability woman fight when challenge street.,2024-12-13 23:43:47
1597,186,543,1,2024-12-23 00:47:29,Fund anything become program collection community player clearly want draw drop science improve.,2024-12-23 00:47:29
1598,241,116,5,2024-01-17 02:16:18,Arm debate almost war look student especially hit upon skin reason inside.,2024-01-17 02:16:18
1599,316,370,4,2024-11-08 22:18:54,Mouth thus perhaps culture seek maintain itself later leave rich.,2024-11-08 22:18:54
1600,46,182,2,2024-07-16 03:31:43,Short down break color truth city our group although.,2024-07-16 03:31:43
1601,554,12,4,2024-02-19 21:36:10,Free brother director area attorney prepare industry doctor meet arrive.,2024-02-19 21:36:10
1602,596,47,3,2024-07-03 22:31:51,Interest plan though can alone become begin security guess worker any way.,2024-07-03 22:31:51
1603,50,543,4,2024-11-04 06:35:13,Likely local conference tax word card yard mouth.,2024-11-04 06:35:13
1604,982,416,1,2024-01-16 17:13:18,Especially cell democratic add less produce account need message.,2024-01-16 17:13:18
1605,469,277,3,2025-05-24 05:12:42,Worker center cultural play look president nation happen teach dream among.,2025-05-24 05:12:42
1606,20,57,3,2024-06-18 23:55:55,Day course care western TV entire risk military concern conference you theory.,2024-06-18 23:55:55
1607,935,519,4,2024-07-24 08:35:39,Option successful here away treat as general operation their walk meet summer.,2024-07-24 08:35:39
1608,255,482,2,2024-01-08 06:37:20,Base worry claim step her off owner break population.,2024-01-08 06:37:20
1609,926,457,1,2024-05-06 11:39:41,Blood music police mean because student.,2024-05-06 11:39:41
1610,242,123,3,2024-07-24 20:32:34,Produce specific stop agency quality good whole discussion analysis receive throughout.,2024-07-24 20:32:34
1611,272,80,2,2024-09-07 18:19:14,Together sport dream care modern still level pull low animal.,2024-09-07 18:19:14
1612,654,355,4,2024-07-05 05:57:49,Realize like up community kid behavior.,2024-07-05 05:57:49
1613,974,65,1,2025-06-12 20:08:30,Senior land how over move mother institution process ok both stock heart.,2025-06-12 20:08:30
1614,860,45,2,2024-09-25 19:44:57,Even cultural gun risk past affect statement cost stay rich win.,2024-09-25 19:44:57
1615,425,122,2,2024-01-03 23:25:24,While tax shoulder must at page once wall always majority.,2024-01-03 23:25:24
1616,379,141,4,2024-01-23 03:26:24,Suddenly challenge five car agree think say mention place to new.,2024-01-23 03:26:24
1617,182,409,4,2024-11-21 09:26:50,Light with present shoulder present candidate tough let war situation fire mouth.,2024-11-21 09:26:50
1618,724,388,3,2024-02-06 20:45:25,Season bank face subject situation control pressure what wide political term fight.,2024-02-06 20:45:25
1619,352,379,3,2024-08-16 05:46:25,News toward under leader week fine program play Congress however.,2024-08-16 05:46:25
1620,5,232,2,2025-08-01 23:41:55,Television effort character write thought so alone treatment right.,2025-08-01 23:41:55
1621,276,523,5,2025-09-08 20:21:55,Between room PM agree risk watch.,2025-09-08 20:21:55
1622,189,193,2,2025-01-23 23:35:20,Whether push network imagine popular spring information you reach add.,2025-01-23 23:35:20
1623,63,167,5,2024-06-23 11:00:31,Article popular police future eye mouth more stand leave gas mother.,2024-06-23 11:00:31
1624,467,162,1,2024-11-28 17:51:45,Long bring body exactly voice join.,2024-11-28 17:51:45
1625,873,541,4,2025-06-09 01:00:03,Here like example share pay blue behavior.,2025-06-09 01:00:03
1626,694,457,3,2025-02-13 22:37:20,Art detail pattern dark write then item item value TV watch.,2025-02-13 22:37:20
1627,849,80,1,2025-03-29 00:53:37,Positive join management several measure provide serve base general.,2025-03-29 00:53:37
1628,762,337,2,2025-04-23 19:40:33,Sport modern would hot budget activity want right.,2025-04-23 19:40:33
1629,883,259,2,2024-09-04 07:46:54,Someone toward today activity country authority commercial good recent phone history month.,2024-09-04 07:46:54
1630,331,370,5,2024-06-24 16:34:53,Security strong issue way crime budget discover along tax.,2024-06-24 16:34:53
1631,897,569,1,2024-05-06 08:55:35,Benefit career east follow control line show most indicate in.,2024-05-06 08:55:35
1632,53,38,1,2025-05-25 03:38:37,Fight rise customer fill doctor about.,2025-05-25 03:38:37
1633,821,476,3,2024-01-17 20:50:09,Food cut job result defense lawyer.,2024-01-17 20:50:09
1634,637,370,5,2025-03-16 20:12:17,Will thing before building heart common summer political responsibility significant city maintain.,2025-03-16 20:12:17
1635,719,281,2,2024-03-11 01:12:54,Perform participant letter will every understand mind memory kitchen trade land service.,2024-03-11 01:12:54
1636,585,280,4,2024-05-09 08:26:57,Trip finish direction training improve here may.,2024-05-09 08:26:57
1637,202,1,1,2024-07-20 18:44:15,Nearly change language few standard question easy.,2024-07-20 18:44:15
1638,590,425,4,2025-08-27 20:12:25,Remember region until team garden central.,2025-08-27 20:12:25
1639,465,253,1,2024-01-21 17:25:54,Development surface brother score increase degree great another around recent wish.,2024-01-21 17:25:54
1640,389,262,4,2025-03-28 03:40:20,Interest son bring improve receive instead special range those project lawyer.,2025-03-28 03:40:20
1641,700,540,4,2024-10-14 08:37:09,Free operation indicate hotel her play name southern glass.,2024-10-14 08:37:09
1642,161,354,3,2024-07-18 07:39:12,Hand exist number soon beyond be suddenly investment when owner decade determine trip.,2024-07-18 07:39:12
1643,272,287,3,2024-08-02 16:44:42,Become statement fund just field no add.,2024-08-02 16:44:42
1644,389,88,3,2025-06-10 22:44:55,Professor pay threat not myself else method assume need film big player.,2025-06-10 22:44:55
1645,415,140,3,2025-05-30 06:40:35,War three bit prevent training past a chance in money too.,2025-05-30 06:40:35
1646,629,31,4,2025-05-06 14:47:52,List air ability meet form growth young cover support.,2025-05-06 14:47:52
1647,457,290,4,2024-09-22 15:42:39,Everybody school general myself experience receive.,2024-09-22 15:42:39
1648,738,519,3,2025-05-05 04:44:17,Middle watch president professional usually receive modern fact painting.,2025-05-05 04:44:17
1649,273,481,4,2024-01-23 02:41:46,Attack real why reach across mean hour near rule hold adult treatment carry.,2024-01-23 02:41:46
1650,888,320,5,2025-04-27 07:09:29,Tend against indicate more fund successful take year probably side.,2025-04-27 07:09:29
1651,468,424,1,2024-02-02 00:05:35,Include sell economy why up election political.,2024-02-02 00:05:35
1652,812,559,2,2025-03-06 02:37:41,Possible peace dinner worker stop say ask chance job six act involve strong.,2025-03-06 02:37:41
1653,544,556,2,2024-06-22 01:00:12,Worry hair face standard management trade attack director and order arrive finish quickly.,2024-06-22 01:00:12
1654,995,387,4,2025-09-10 01:50:40,Local drug interest condition computer center strong stand ago.,2025-09-10 01:50:40
1655,568,59,2,2025-01-11 08:43:43,Leave then exactly sign matter those economic stay mention heavy writer.,2025-01-11 08:43:43
1656,365,418,1,2025-09-08 16:03:05,Thousand tell fly guy plant behavior quickly group hear law.,2025-09-08 16:03:05
1657,96,372,4,2025-03-13 02:30:43,Investment increase nothing watch maybe page yes across relationship card office much hand.,2025-03-13 02:30:43
1658,59,161,3,2024-09-30 19:15:55,Power anyone line still trial worry country result fact.,2024-09-30 19:15:55
1659,45,592,4,2024-06-10 11:31:56,Else north area from military behavior night.,2024-06-10 11:31:56
1660,480,43,3,2025-07-05 09:34:34,Near light thousand administration policy part amount not nor list near I.,2025-07-05 09:34:34
1661,992,445,5,2024-03-08 02:07:31,Walk result thing dog design spring simply than short both.,2024-03-08 02:07:31
1662,771,30,2,2024-05-29 02:47:35,Someone PM cold spend data some east.,2024-05-29 02:47:35
1663,475,41,1,2024-11-16 06:26:34,Method ok relationship view environmental series more generation know beautiful police across.,2024-11-16 06:26:34
1664,580,408,1,2024-12-18 03:56:16,Table hand resource provide recent often art ability push game raise way commercial.,2024-12-18 03:56:16
1665,934,340,4,2024-10-07 10:21:12,Edge hour these within push floor federal happy once threat.,2024-10-07 10:21:12
1666,219,91,1,2024-10-21 23:05:25,Much near minute certain old former fight those high peace glass.,2024-10-21 23:05:25
1667,579,298,3,2025-06-17 02:44:39,Everything door stuff loss employee indeed woman check company.,2025-06-17 02:44:39
1668,24,486,1,2025-01-04 12:07:42,Pm race moment more billion choose throw change participant ago help action.,2025-01-04 12:07:42
1669,923,133,4,2024-05-04 10:13:56,Hard where analysis specific tree lot reality.,2024-05-04 10:13:56
1670,30,173,1,2025-01-07 18:59:00,Society more middle do pass investment strong.,2025-01-07 18:59:00
1671,648,63,1,2025-01-09 16:14:46,Toward film I bed its gas seven produce need son someone wife gun.,2025-01-09 16:14:46
1672,253,227,5,2024-11-28 16:55:36,Camera nature focus between everybody recognize learn well blood.,2024-11-28 16:55:36
1673,743,505,2,2024-02-09 09:29:59,Budget statement buy whose fine person prove activity above effect its peace short.,2024-02-09 09:29:59
1674,580,351,5,2024-06-22 03:50:37,Measure Congress night party matter perform all short court.,2024-06-22 03:50:37
1675,932,221,4,2024-04-03 11:56:58,Congress event party however hospital dinner beyond.,2024-04-03 11:56:58
1676,883,412,2,2025-05-27 06:18:55,Participant onto thing continue general stock throw executive cause nearly population run why.,2025-05-27 06:18:55
1677,959,163,4,2024-02-06 04:21:49,Truth stand reveal simply there toward either.,2024-02-06 04:21:49
1678,524,402,3,2024-11-08 08:08:34,Score source environment pull there meet space mind right thought mission try hand end.,2024-11-08 08:08:34
1679,174,404,3,2025-01-24 08:04:27,Room wind recognize meet anything whole far improve often least.,2025-01-24 08:04:27
1680,717,488,4,2025-08-21 11:37:31,Concern read go book thank large activity.,2025-08-21 11:37:31
1681,6,74,1,2024-03-05 04:58:44,Live color action so perhaps law always trade.,2024-03-05 04:58:44
1682,554,362,2,2024-01-16 16:53:52,Better environment positive letter market best.,2024-01-16 16:53:52
1683,721,550,5,2025-06-10 09:58:47,Material early admit open manage activity place movement.,2025-06-10 09:58:47
1684,781,42,3,2025-09-12 15:22:27,Feeling these main foreign friend help agree.,2025-09-12 15:22:27
1685,65,504,3,2025-03-28 16:56:40,Culture door operation down action quite product seat.,2025-03-28 16:56:40
1686,524,280,5,2024-11-04 22:13:55,Week wrong control hundred offer federal.,2024-11-04 22:13:55
1687,846,75,3,2025-01-18 06:00:14,See school word success sport cup unit cover stuff.,2025-01-18 06:00:14
1688,347,446,5,2024-01-16 22:24:29,Fear international staff world turn few space.,2024-01-16 22:24:29
1689,51,77,5,2024-07-08 14:07:45,Age whatever word firm produce member mission effect give.,2024-07-08 14:07:45
1690,390,301,2,2024-10-30 20:00:44,Those mouth blood else garden station almost fine by raise.,2024-10-30 20:00:44
1691,573,276,4,2024-03-06 07:44:37,Yes source not explain situation table six call.,2024-03-06 07:44:37
1692,515,480,5,2025-07-02 05:54:28,That hard our worker weight these six interest.,2025-07-02 05:54:28
1693,970,320,3,2025-04-09 01:26:17,Interview market energy feeling sit there among probably.,2025-04-09 01:26:17
1694,528,204,4,2025-06-04 09:05:05,Apply whether final TV coach notice someone financial probably move upon.,2025-06-04 09:05:05
1695,5,224,5,2024-07-16 12:02:37,Occur defense fly affect newspaper carry spend common three tonight also skin result.,2024-07-16 12:02:37
1696,393,335,3,2024-07-29 01:20:05,Begin capital allow focus heavy open front language just check.,2024-07-29 01:20:05
1697,250,472,5,2024-04-07 17:35:50,Significant fight former relate family which eight sell part.,2024-04-07 17:35:50
1698,586,196,2,2025-06-24 05:24:20,Rule mention throw thus special trouble.,2025-06-24 05:24:20
1699,462,413,2,2024-12-03 07:46:31,Light security mind all card range land threat central.,2024-12-03 07:46:31
1700,485,215,3,2025-09-02 09:55:01,Their majority investment spring control around lawyer town have guess organization would.,2025-09-02 09:55:01
1701,75,504,2,2024-10-10 14:51:42,Culture eye there early style machine difference.,2024-10-10 14:51:42
1702,491,183,3,2024-03-05 05:41:19,Summer lawyer buy become stay want.,2024-03-05 05:41:19
1703,908,109,1,2024-06-15 13:09:14,General surface suddenly article story hit probably politics way still nor amount everything.,2024-06-15 13:09:14
1704,496,586,1,2024-07-19 23:52:16,Play gas source people writer region pay sense drive pay figure.,2024-07-19 23:52:16
1705,936,529,1,2024-12-03 06:23:05,Officer girl doctor development sound night reflect and run inside serve focus example.,2024-12-03 06:23:05
1706,448,323,3,2024-11-17 11:47:00,Either no matter left may successful leader business despite ready already when.,2024-11-17 11:47:00
1707,81,233,3,2024-06-16 11:58:54,Tree tax close wait light but hard your center early oil president.,2024-06-16 11:58:54
1708,882,162,4,2025-06-02 13:27:20,Spend in million character sort since.,2025-06-02 13:27:20
1709,705,413,5,2024-06-15 22:31:22,Health whole movie save decide begin character charge result itself.,2024-06-15 22:31:22
1710,556,54,3,2025-01-23 17:21:30,Blood score sea course believe under above pass be despite kid including they north.,2025-01-23 17:21:30
1711,133,389,4,2024-04-27 13:00:41,International couple necessary issue design just left across year from light top hit.,2024-04-27 13:00:41
1712,590,478,3,2025-07-07 04:39:30,Threat standard old describe structure himself crime public good.,2025-07-07 04:39:30
1713,201,181,3,2024-07-30 08:12:05,Thousand store happy process indeed there particularly deep drug value teach.,2024-07-30 08:12:05
1714,658,567,3,2025-01-24 15:39:57,No nearly beautiful explain campaign oil well cultural work per.,2025-01-24 15:39:57
1715,814,471,5,2024-01-03 19:24:40,Low employee popular health past writer then food old class list improve current.,2024-01-03 19:24:40
1716,933,445,2,2025-09-02 05:53:04,Word partner if produce alone well read.,2025-09-02 05:53:04
1717,645,491,4,2025-02-28 15:43:12,Off left may form least someone.,2025-02-28 15:43:12
1718,424,589,1,2025-04-15 13:37:59,Operation major attention need despite song such out issue table foreign among power.,2025-04-15 13:37:59
1719,898,290,3,2024-09-25 22:34:56,Field kind short grow hard everybody ability method call data when agency mean.,2024-09-25 22:34:56
1720,401,177,3,2025-06-28 14:05:49,Discuss start cold live baby yet participant career process.,2025-06-28 14:05:49
1721,834,305,3,2024-01-20 10:59:28,Beat choice ok almost allow appear yes because how none management.,2024-01-20 10:59:28
1722,130,34,1,2025-02-19 03:50:42,Or its dog others fish rather structure security single audience.,2025-02-19 03:50:42
1723,361,444,1,2024-03-08 21:47:03,Send civil talk their right call similar beautiful.,2024-03-08 21:47:03
1724,986,459,2,2024-01-09 00:26:49,Finally ahead performance and nature base treatment admit president imagine.,2024-01-09 00:26:49
1725,592,107,3,2025-09-01 02:56:17,Break fact major believe similar accept bad.,2025-09-01 02:56:17
1726,709,550,3,2025-05-24 03:21:27,Matter simple pick our case wife forward shake shoulder.,2025-05-24 03:21:27
1727,555,81,3,2024-03-20 09:42:25,Yet million part mission likely movement night.,2024-03-20 09:42:25
1728,149,537,1,2025-08-02 12:17:34,Game produce entire fear social they.,2025-08-02 12:17:34
1729,107,518,3,2024-05-26 21:27:07,Own tend society guy store too work attack.,2024-05-26 21:27:07
1730,783,168,3,2024-04-25 02:15:31,Each summer west do accept thought sea green event anything ball fill.,2024-04-25 02:15:31
1731,419,342,3,2025-01-08 07:47:53,Successful weight loss since idea site poor close money.,2025-01-08 07:47:53
1732,558,496,2,2025-02-17 20:46:23,Phone model plan hard performance subject newspaper.,2025-02-17 20:46:23
1733,341,160,1,2024-11-25 02:26:32,Receive challenge age day per executive say truth better attorney.,2024-11-25 02:26:32
1734,229,458,1,2025-09-02 12:27:17,Race my tax face just possible true mention agreement conference not move.,2025-09-02 12:27:17
1735,747,569,1,2024-01-27 16:35:00,Instead cell election film nice respond music somebody where business might suddenly arm.,2024-01-27 16:35:00
1736,742,460,5,2025-02-12 14:36:34,Bring institution account someone set however.,2025-02-12 14:36:34
1737,865,144,3,2024-01-25 03:22:15,Benefit some allow not art certainly should always charge.,2024-01-25 03:22:15
1738,669,267,1,2025-03-23 19:47:48,Father population beat tree conference job.,2025-03-23 19:47:48
1739,52,236,3,2024-06-30 05:17:20,Government later lot long worry beat beyond believe beat country picture beyond create.,2024-06-30 05:17:20
1740,341,521,1,2024-04-07 10:55:40,Son it discover entire event bad.,2024-04-07 10:55:40
1741,603,432,3,2024-09-17 11:24:03,Down parent court his house off quality realize view their soon visit camera.,2024-09-17 11:24:03
1742,329,213,5,2025-01-17 08:29:04,Reflect before new who top help.,2025-01-17 08:29:04
1743,203,379,5,2025-04-04 09:30:01,Difficult respond common whole bit every lose spend pass short result include.,2025-04-04 09:30:01
1744,785,185,4,2024-07-30 02:14:48,Number save nature must moment should.,2024-07-30 02:14:48
1745,645,286,4,2024-09-25 05:42:25,Term on city there difficult bit none bring father sister wide by green.,2024-09-25 05:42:25
1746,725,65,1,2025-04-26 05:25:35,Total beyond performance easy every page car send.,2025-04-26 05:25:35
1747,384,15,2,2025-03-20 07:00:56,Gun tell wife have between skin debate wrong political civil lawyer.,2025-03-20 07:00:56
1748,871,295,5,2024-03-26 09:29:52,Voice go most now wind issue create idea list worry significant.,2024-03-26 09:29:52
1749,492,249,2,2024-11-23 12:26:39,Every between close mention though outside doctor property score surface hit.,2024-11-23 12:26:39
1750,393,312,2,2025-04-06 22:11:20,Approach reach federal under form girl then attack.,2025-04-06 22:11:20
1751,747,582,3,2024-10-27 17:56:51,Finish base others black receive then note.,2024-10-27 17:56:51
1752,371,552,4,2025-04-23 09:15:25,Into together wind each way themselves recent open money none.,2025-04-23 09:15:25
1753,43,76,1,2025-02-10 06:41:03,Whose drive wall different born than administration only former.,2025-02-10 06:41:03
1754,679,129,5,2025-05-05 01:49:39,Wife increase choose among house maybe such effort before yes a sport rise.,2025-05-05 01:49:39
1755,36,61,1,2025-02-12 23:18:31,Fine name police main material rise still today budget.,2025-02-12 23:18:31
1756,749,453,5,2024-07-11 09:35:51,Maybe political subject near piece however former.,2024-07-11 09:35:51
1757,102,195,2,2024-04-09 12:17:34,Window system community skin lot message growth southern foot fund even though pay.,2024-04-09 12:17:34
1758,372,481,3,2024-10-01 07:43:57,Respond piece cultural himself stay give certain mention street sometimes ground rule.,2024-10-01 07:43:57
1759,98,332,2,2024-02-28 12:07:42,Act argue change career radio season sign involve generation.,2024-02-28 12:07:42
