rating_id,user_id,movie_id,rating_score,rating_date,review_text,created_at
884,153,181,4,2025-07-12 18:25:44,Finally ago leader another of cold write let.,2025-07-12 18:25:44
885,680,52,3,2024-11-22 20:30:30,Employee kid rule reason federal better loss result.,2024-11-22 20:30:30
886,816,299,5,2025-01-15 18:41:40,Interesting after which strategy game evidence even near.,2025-01-15 18:41:40
887,493,483,2,2025-02-17 14:04:10,Machine exactly final hotel receive responsibility future very understand contain occur beyond.,2025-02-17 14:04:10
888,629,564,1,2024-04-01 22:00:15,Attention people yourself technology majority ask staff short make arrive over citizen take.,2024-04-01 22:00:15
889,946,414,4,2024-05-07 17:40:37,Play idea simply beautiful public because firm.,2024-05-07 17:40:37
890,969,548,2,2025-08-02 08:31:51,Spring should Congress process worry international.,2025-08-02 08:31:51
891,448,9,4,2024-03-30 05:30:24,Bank degree probably as traditional return prove.,2024-03-30 05:30:24
892,316,547,1,2024-01-11 23:13:11,Himself action rest management foreign theory.,2024-01-11 23:13:11
893,272,326,2,2025-01-26 17:44:28,Base born positive buy ever local.,2025-01-26 17:44:28
894,253,134,1,2025-07-23 19:08:34,Us city size doctor fund miss as green.,2025-07-23 19:08:34
895,82,135,2,2025-08-11 06:24:45,Ground would sense each learn region paper analysis must.,2025-08-11 06:24:45
896,967,136,5,2024-11-04 08:12:19,Discover class loss us cultural baby single best inside customer.,2024-11-04 08:12:19
897,175,556,3,2025-05-29 22:52:16,Paper thank exist medical save chance pick his again similar.,2025-05-29 22:52:16
898,363,421,5,2024-01-05 23:50:18,Change painting build city raise south southern.,2024-01-05 23:50:18
899,519,574,5,2024-08-01 13:56:50,Age follow soon bank seat list society economic method experience realize water both.,2024-08-01 13:56:50
900,538,527,2,2024-10-29 03:45:12,However lead thought trade material ball computer debate simply free deep moment situation.,2024-10-29 03:45:12
901,408,164,1,2024-11-05 18:50:09,Job action nor institution always form world race performance choose way maintain continue.,2024-11-05 18:50:09
902,289,130,1,2025-05-28 03:08:37,Place shake lead note yet already nearly necessary each key cause money social.,2025-05-28 03:08:37
903,586,55,5,2025-03-25 16:46:11,Concern minute low at kitchen management focus eat very second stop rich.,2025-03-25 16:46:11
904,643,345,3,2025-01-16 23:34:33,Cultural whether able order three rich middle seem paper since.,2025-01-16 23:34:33
905,870,112,4,2025-03-14 07:12:23,Mouth cause difficult tough special fund send speak ago.,2025-03-14 07:12:23
906,497,571,5,2024-11-26 08:26:31,Above thought talk star step program floor.,2024-11-26 08:26:31
907,905,181,5,2024-10-30 14:53:14,Kitchen to rule money simple per chance onto where husband pull.,2024-10-30 14:53:14
908,766,300,1,2025-03-26 08:30:34,Budget unit brother by sister maybe else resource pass at father.,2025-03-26 08:30:34
909,618,360,1,2024-09-17 12:31:20,Position teacher available effect nothing read very allow share recently cup fight.,2024-09-17 12:31:20
910,163,89,3,2025-09-11 11:20:34,Medical own none feel your edge want manager happen sell reflect police.,2025-09-11 11:20:34
911,962,296,5,2024-05-29 09:47:58,Especially system fine purpose property maybe.,2024-05-29 09:47:58
912,707,123,3,2025-05-12 15:49:02,Phone education painting wife early specific stay.,2025-05-12 15:49:02
913,659,371,5,2024-01-18 23:44:01,Your do tell soldier wear catch.,2024-01-18 23:44:01
914,288,587,3,2024-09-28 14:47:34,Process question measure brother nice friend.,2024-09-28 14:47:34
915,579,21,1,2024-03-12 22:08:01,Much although become finally any local detail run.,2024-03-12 22:08:01
916,380,138,4,2024-04-23 06:03:06,Important true after oil news step.,2024-04-23 06:03:06
917,735,569,2,2024-05-05 15:03:01,Peace because matter upon success reveal buy indeed system team.,2024-05-05 15:03:01
918,345,452,1,2024-09-28 07:01:41,Station bag court coach character wind now television.,2024-09-28 07:01:41
919,260,61,3,2025-09-05 13:59:40,Hand memory begin national who none war open nothing low throughout positive.,2025-09-05 13:59:40
920,772,50,5,2024-10-31 08:57:04,Along final provide open he though state push already record.,2024-10-31 08:57:04
921,485,282,1,2025-01-01 18:23:21,Range enjoy citizen spend employee include fund garden task safe painting major.,2025-01-01 18:23:21
922,937,78,4,2024-10-29 01:46:00,Off item office edge in lay.,2024-10-29 01:46:00
923,70,241,5,2024-09-14 06:34:17,Already note we account news ever.,2024-09-14 06:34:17
924,157,540,1,2025-09-19 05:48:56,It here store later they wind few news.,2025-09-19 05:48:56
925,985,328,3,2025-06-04 17:06:22,I detail already probably including prevent want mind.,2025-06-04 17:06:22
926,377,443,4,2024-12-21 22:25:34,Possible identify heavy significant eye high finally short talk character back your social.,2024-12-21 22:25:34
927,570,415,3,2025-03-06 15:53:37,Individual run any night finish draw.,2025-03-06 15:53:37
928,533,526,2,2025-04-11 03:58:23,Me hair police personal push interview guy.,2025-04-11 03:58:23
929,675,134,1,2025-08-05 06:25:36,Project offer laugh along surface know.,2025-08-05 06:25:36
930,690,288,2,2025-08-09 19:39:09,Pay worry wide main sell sell official.,2025-08-09 19:39:09
931,585,52,4,2024-08-09 10:41:05,Method deal central energy artist vote.,2024-08-09 10:41:05
932,454,540,4,2024-04-29 11:23:45,Teacher instead lay exactly create many mouth public already me.,2024-04-29 11:23:45
933,439,382,3,2024-08-30 21:27:11,Boy practice drive matter possible positive next morning star stand probably contain.,2024-08-30 21:27:11
934,876,295,3,2025-04-27 23:12:19,Such form remember crime community green throughout involve office know see event.,2025-04-27 23:12:19
935,101,206,1,2025-02-13 01:05:07,Special like a resource character top religious with summer.,2025-02-13 01:05:07
936,633,561,1,2024-05-29 02:52:15,Food manager suggest wife view medical article your.,2024-05-29 02:52:15
937,545,522,1,2024-09-14 04:57:13,That decide quite traditional firm safe hold evidence capital.,2024-09-14 04:57:13
938,793,189,3,2024-04-08 23:34:04,Use machine rock bill whether list receive service concern responsibility none along general.,2024-04-08 23:34:04
939,732,65,2,2025-08-03 12:48:24,Traditional future difficult off same perhaps future statement suffer forget.,2025-08-03 12:48:24
940,998,295,3,2025-06-09 19:29:17,Job player toward crime quickly single.,2025-06-09 19:29:17
941,410,536,5,2024-02-03 03:34:39,Break meeting speech sort share suggest American early consumer you seat until.,2024-02-03 03:34:39
942,966,314,4,2024-12-13 10:01:05,Rise certainly draw expert wind in.,2024-12-13 10:01:05
943,816,82,4,2024-11-23 08:21:49,Need decide issue especially lay gas.,2024-11-23 08:21:49
944,588,359,2,2024-04-14 16:56:04,Mr gas person you machine through very lay experience week significant happen.,2024-04-14 16:56:04
945,84,403,5,2025-03-29 11:59:33,To issue quickly family number key represent present.,2025-03-29 11:59:33
946,626,351,5,2024-08-18 20:28:53,Air but evidence only person great water her expect turn upon long fish.,2024-08-18 20:28:53
947,254,301,4,2024-04-30 20:21:32,Large between from professional mission land.,2024-04-30 20:21:32
948,295,358,5,2024-01-10 10:35:37,Call popular public north entire among nothing trial radio.,2024-01-10 10:35:37
949,584,449,5,2024-05-05 18:26:12,Probably generation southern stage down activity college.,2024-05-05 18:26:12
950,191,501,1,2024-05-30 03:15:23,Customer various lay professional use century need range charge.,2024-05-30 03:15:23
951,901,375,2,2025-07-13 17:31:19,Head such hair society game summer modern miss.,2025-07-13 17:31:19
952,67,355,5,2024-06-29 13:06:38,Ok fill letter teacher less girl wall thing.,2024-06-29 13:06:38
953,369,593,1,2024-10-14 18:43:53,Involve themselves national research fire trouble out your single argue home program middle want.,2024-10-14 18:43:53
954,477,534,1,2024-04-15 20:45:26,Current feel occur nearly build religious my media open.,2024-04-15 20:45:26
955,445,297,5,2024-02-23 07:18:35,Difference future difficult front world member.,2024-02-23 07:18:35
956,272,412,3,2024-10-31 16:00:28,Deep cup and notice share much debate music.,2024-10-31 16:00:28
957,390,136,2,2024-09-25 20:14:15,Right guy interview onto term large your letter.,2024-09-25 20:14:15
958,10,518,4,2024-10-16 03:54:31,Too with enjoy south fall theory.,2024-10-16 03:54:31
959,585,20,2,2024-11-19 10:21:35,Citizen hear such this message eye which join worker per play.,2024-11-19 10:21:35
960,932,127,2,2024-05-29 16:32:05,They trip carry though protect two nation ball certainly.,2024-05-29 16:32:05
961,378,87,1,2024-06-22 00:46:34,American free school window carry million professional loss.,2024-06-22 00:46:34
962,939,310,4,2025-08-09 04:29:23,Former lose now recognize space after what coach where.,2025-08-09 04:29:23
963,844,457,4,2024-12-15 05:10:58,Space clear among receive hot reality tell institution.,2024-12-15 05:10:58
964,979,134,5,2025-01-15 02:17:37,Drug into attack nearly citizen hear team hope yet for Democrat research thus.,2025-01-15 02:17:37
965,558,237,3,2024-06-17 10:08:31,Spring interesting account white scene something evidence.,2024-06-17 10:08:31
966,756,177,2,2024-02-17 17:53:52,Significant total keep prove wear plan trial worry.,2024-02-17 17:53:52
967,494,534,1,2025-03-12 05:58:00,Trouble factor onto camera perform themselves sing.,2025-03-12 05:58:00
968,731,60,2,2024-08-01 11:52:00,Property full they fire in finish back growth drop new soldier.,2024-08-01 11:52:00
969,947,48,1,2025-01-29 23:44:09,Trouble customer what support director care.,2025-01-29 23:44:09
970,791,271,4,2024-01-08 07:46:54,About ever garden same big theory main south.,2024-01-08 07:46:54
971,538,368,5,2025-03-16 07:50:29,Fear without sometimes reach recent admit get.,2025-03-16 07:50:29
972,67,157,5,2025-08-14 08:11:09,Keep three price few source man PM thousand hospital kid.,2025-08-14 08:11:09
973,328,97,5,2024-12-13 17:35:08,Night laugh build traditional wind leave religious husband bill future later pattern impact.,2024-12-13 17:35:08
974,890,114,2,2024-04-05 07:56:25,Take maybe fly every international wind it realize.,2024-04-05 07:56:25
975,818,239,3,2025-07-18 16:54:51,Official minute radio hospital image development statement wife less.,2025-07-18 16:54:51
976,799,364,4,2024-10-17 11:37:14,Play example job continue side nor sell myself dream.,2024-10-17 11:37:14
977,754,105,1,2025-05-04 08:38:17,Behavior Congress bill I decision message reason paper business law value.,2025-05-04 08:38:17
978,71,338,5,2025-07-19 04:34:06,Career thought through million establish shoulder.,2025-07-19 04:34:06
979,608,83,5,2024-01-12 09:01:38,Product quite prove effect take daughter institution option Mrs add she true far.,2024-01-12 09:01:38
980,905,407,2,2025-09-03 19:37:36,Seek affect argue organization somebody charge author whose hundred tough.,2025-09-03 19:37:36
981,915,107,2,2025-05-16 14:52:42,Than job rest energy gas statement yard school truth.,2025-05-16 14:52:42
982,28,538,3,2025-03-21 22:59:07,Cut man themselves memory realize quite read talk.,2025-03-21 22:59:07
983,806,579,4,2025-09-18 02:18:27,Glass season mission child teach especially finally back.,2025-09-18 02:18:27
984,703,114,2,2024-03-21 05:45:18,Film imagine nice together hot education pressure put give.,2024-03-21 05:45:18
985,976,309,5,2024-02-01 15:12:51,Level hotel baby pattern small career sound.,2024-02-01 15:12:51
986,88,136,4,2025-05-10 08:22:06,Tv individual sea one story investment edge.,2025-05-10 08:22:06
987,993,35,3,2024-11-05 12:29:28,Someone save he important put American short certainly everyone home current to responsibility.,2024-11-05 12:29:28
988,266,42,4,2025-01-17 09:08:42,Local goal knowledge treatment future civil quite defense speak result respond.,2025-01-17 09:08:42
989,663,242,1,2024-01-15 02:52:21,Film eye choice rock example message recent toward design course weight.,2024-01-15 02:52:21
990,525,214,4,2024-05-23 07:14:44,Mention back black and least day law build safe Mr well.,2024-05-23 07:14:44
991,481,53,4,2025-09-11 10:55:19,Most authority newspaper child bank film worry.,2025-09-11 10:55:19
992,240,561,2,2025-07-05 02:20:22,Evening him pull scientist stay time.,2025-07-05 02:20:22
993,13,251,3,2025-07-29 17:32:41,Various write instead would report where capital why relationship course and instead.,2025-07-29 17:32:41
994,427,246,4,2024-11-04 05:39:47,Process act finish mention thus seven involve goal morning next executive.,2024-11-04 05:39:47
995,515,246,3,2024-08-28 07:42:47,Return moment peace half affect he successful least.,2024-08-28 07:42:47
996,986,560,4,2024-07-02 08:28:35,Eat grow yard control almost evidence himself.,2024-07-02 08:28:35
997,291,592,3,2025-02-17 06:03:27,Allow moment site always Congress seven question people east floor a industry major.,2025-02-17 06:03:27
998,470,459,4,2024-07-15 22:28:13,Unit address long box have bed garden red contain method Congress tax.,2024-07-15 22:28:13
999,873,214,2,2025-08-06 01:13:49,Break receive charge maintain list mention news doctor.,2025-08-06 01:13:49
1000,679,71,1,2024-07-30 09:40:34,Tend camera book collection already party well debate off improve until.,2024-07-30 09:40:34
1001,174,287,1,2025-07-11 14:47:41,Indeed year he purpose wear military dream occur.,2025-07-11 14:47:41
1002,728,580,1,2024-04-15 02:23:03,Audience artist later reach west there fish single happen again.,2024-04-15 02:23:03
1003,25,311,3,2024-05-06 15:14:03,Son note fill watch candidate former firm.,2024-05-06 15:14:03
1004,753,571,1,2024-03-02 02:25:22,Career bar local try few case still poor writer heart happy official.,2024-03-02 02:25:22
1005,74,539,3,2024-03-28 10:32:45,Listen manage upon concern key pattern Democrat response radio sing second industry community.,2024-03-28 10:32:45
1006,475,262,1,2025-06-26 17:30:01,Hospital tough remember short bad forward.,2025-06-26 17:30:01
1007,555,13,5,2025-02-13 05:51:40,Summer best simply cost week resource development nice work hair television be us.,2025-02-13 05:51:40
1008,915,102,2,2025-01-31 14:02:18,Moment black several draw difference necessary evidence.,2025-01-31 14:02:18
1009,769,96,3,2024-03-24 19:13:41,Serve at personal but college language.,2024-03-24 19:13:41
1010,345,563,3,2024-01-08 13:11:15,Keep process pull thank team behind seem network between whom during.,2024-01-08 13:11:15
1011,800,368,1,2024-02-01 13:48:47,Director without speech third start around under.,2024-02-01 13:48:47
1012,960,270,2,2025-07-30 02:41:47,National long present animal should source less kid talk buy.,2025-07-30 02:41:47
1013,604,423,3,2024-09-26 14:01:55,Expert few young want myself approach ask never east our will turn.,2024-09-26 14:01:55
1014,329,51,1,2024-07-03 08:48:12,Major society part stand also sometimes building pretty three inside hard again explain.,2024-07-03 08:48:12
1015,414,87,4,2025-04-22 15:51:17,Cost marriage school how often try describe wind certain.,2025-04-22 15:51:17
1016,734,160,2,2025-01-07 09:33:35,Ever place body serve available since section he rock through thus support miss.,2025-01-07 09:33:35
1017,7,337,1,2024-09-10 03:39:51,Friend way require pressure rich research language.,2024-09-10 03:39:51
1018,474,91,1,2025-08-15 13:07:18,Cup focus million treatment growth strategy trade ready rock.,2025-08-15 13:07:18
1019,551,590,1,2024-07-10 03:30:48,Quite different right key huge remember deal somebody amount avoid environmental.,2024-07-10 03:30:48
1020,662,318,2,2024-07-11 04:23:34,Item front wish talk factor spring trial.,2024-07-11 04:23:34
1021,324,341,4,2024-12-25 06:57:41,Rule prepare gun western local probably trip everybody which deep.,2024-12-25 06:57:41
1022,637,43,3,2024-11-24 01:53:57,After enter relationship table around hope major attorney candidate wind.,2024-11-24 01:53:57
1023,229,118,2,2025-05-18 00:01:36,Will notice rather word evidence change.,2025-05-18 00:01:36
1024,629,472,3,2025-03-20 17:21:42,Reflect book against activity population she ability record sister case attention.,2025-03-20 17:21:42
1025,838,105,2,2024-05-27 05:37:59,Various ready reveal sound company give.,2024-05-27 05:37:59
1026,851,85,5,2024-07-21 01:52:23,They clearly animal learn instead child play board wait head serious sell.,2024-07-21 01:52:23
1027,714,310,5,2024-01-28 05:21:22,Sell agreement industry design agree work apply business find.,2024-01-28 05:21:22
1028,176,62,3,2025-08-27 08:36:33,Area sing high enjoy available local good study.,2025-08-27 08:36:33
1029,933,20,4,2024-09-29 01:23:35,Know table thought describe large condition put.,2024-09-29 01:23:35
1030,471,161,5,2025-03-30 21:07:58,Every from suggest organization course near today.,2025-03-30 21:07:58
1031,956,509,5,2024-01-02 10:14:54,Talk doctor change large peace interest.,2024-01-02 10:14:54
1032,892,286,3,2025-01-15 20:51:38,Her across loss actually hand reality maybe rate measure more.,2025-01-15 20:51:38
1033,835,413,3,2024-10-11 06:53:49,Hotel sister condition send imagine she he.,2024-10-11 06:53:49
1034,154,38,2,2024-09-30 10:00:26,Beat theory including condition image put benefit skill process bill.,2024-09-30 10:00:26
1035,972,22,2,2024-12-22 10:16:27,Wide different maintain every per property song health enough you type create involve.,2024-12-22 10:16:27
1036,196,123,5,2024-05-30 04:50:17,Also they firm day national civil defense.,2024-05-30 04:50:17
1037,560,396,5,2025-06-28 15:15:52,Few election cost begin at including item free also.,2025-06-28 15:15:52
1038,740,572,1,2025-05-01 16:22:04,Create more another family even central take chair general small else campaign far.,2025-05-01 16:22:04
1039,798,107,3,2024-10-24 19:45:02,Song model several important sit girl town prove try attention.,2024-10-24 19:45:02
1040,937,384,2,2024-06-03 17:57:28,Air nor black eight federal during sign nice reveal reality yard ground.,2024-06-03 17:57:28
1041,93,479,5,2025-03-21 19:47:01,Both lot daughter meeting everything son find effect laugh southern after for.,2025-03-21 19:47:01
1042,619,209,1,2024-03-06 14:26:22,Tax actually general oil eye gun mind grow.,2024-03-06 14:26:22
1043,748,346,2,2024-08-20 10:21:40,Scientist garden effort every owner kid strategy foot word.,2024-08-20 10:21:40
1044,696,243,3,2024-11-04 14:42:02,Benefit central expert city president bag image building tough teach answer development school born.,2024-11-04 14:42:02
1045,371,454,4,2024-09-02 05:22:08,Look board enough prepare difficult wife environmental third itself.,2024-09-02 05:22:08
1046,464,398,1,2025-06-24 05:11:45,Main any raise pick a main whom number.,2025-06-24 05:11:45
1047,286,182,5,2025-02-10 11:38:27,Administration its probably reflect one cup according network lose worry produce wall rate.,2025-02-10 11:38:27
1048,500,86,1,2025-05-08 07:11:25,Late teach decade only national station strategy thought third give apply yourself scene.,2025-05-08 07:11:25
1049,523,8,5,2024-03-28 12:57:34,Ok continue different occur anyone choice prove result.,2024-03-28 12:57:34
1050,593,41,5,2024-05-04 01:22:15,Give happen address section second everybody approach include kind consumer medical woman color.,2024-05-04 01:22:15
1051,887,345,5,2025-02-07 22:40:46,House truth finish boy building blood so.,2025-02-07 22:40:46
1052,471,10,3,2024-10-21 22:57:22,Shoulder fish make despite the better TV sound land.,2024-10-21 22:57:22
1053,340,340,2,2025-07-27 18:40:38,As his left reason remain church.,2025-07-27 18:40:38
1054,937,171,5,2024-12-02 23:26:01,Skin that season seat father make discuss important agent.,2024-12-02 23:26:01
1055,834,294,2,2025-05-14 05:17:56,Bed image answer take read page age big occur.,2025-05-14 05:17:56
1056,30,541,2,2024-04-25 21:33:58,Occur school move middle total toward physical face east cover generation option.,2024-04-25 21:33:58
1057,263,521,2,2024-04-01 17:15:01,Short such seven hard shake size program.,2024-04-01 17:15:01
1058,988,531,4,2024-01-18 17:05:23,Appear benefit team under others analysis you few cover under nature culture administration.,2024-01-18 17:05:23
1059,71,104,4,2024-04-15 22:26:57,Month family manage democratic after what song city practice discover fish man.,2024-04-15 22:26:57
1060,203,12,5,2025-07-06 10:11:37,Writer natural environment step mean world push offer even present red term discussion.,2025-07-06 10:11:37
1061,400,137,1,2025-05-08 19:07:36,Community if whatever personal least near hope item show character.,2025-05-08 19:07:36
1062,543,513,5,2025-05-18 07:04:52,Lose issue dinner rich campaign perhaps.,2025-05-18 07:04:52
1063,959,321,5,2025-07-08 22:27:13,Level page our air history success deep arrive look right hold my better.,2025-07-08 22:27:13
1064,825,326,3,2025-04-25 20:34:08,Yourself institution now make to Mr.,2025-04-25 20:34:08
1065,82,120,4,2025-08-23 18:41:09,Respond a letter center break bill own attack send choice.,2025-08-23 18:41:09
1066,961,333,2,2024-07-02 14:04:32,Mother could tree miss able what someone claim week mouth do task easy.,2024-07-02 14:04:32
1067,698,320,5,2025-08-17 22:07:17,Science law occur positive morning accept address claim national item measure later fast.,2025-08-17 22:07:17
1068,393,225,2,2025-07-13 02:39:10,Issue seat toward quite relate control guy hold sister huge provide.,2025-07-13 02:39:10
1069,64,374,2,2024-04-16 16:29:30,Physical his thing woman let something large usually begin hit without.,2024-04-16 16:29:30
1070,307,127,2,2024-12-20 20:43:19,Most hear gas area edge American yet girl drop above.,2024-12-20 20:43:19
1071,544,383,1,2025-08-25 05:27:46,Player resource likely list also story she.,2025-08-25 05:27:46
1072,249,115,5,2024-12-18 18:27:16,Provide pretty ask offer someone marriage fast prevent small mission shoulder onto enjoy.,2024-12-18 18:27:16
1073,173,226,1,2024-07-27 05:23:16,Again almost central man time investment thus side sure want conference clearly factor.,2024-07-27 05:23:16
1074,670,307,2,2024-11-19 19:30:29,From rock role personal couple box.,2024-11-19 19:30:29
1075,981,341,3,2024-08-10 06:37:57,Green much experience bring phone soldier report test either style tough event away.,2024-08-10 06:37:57
1076,530,588,2,2024-10-07 09:42:59,Seem offer even spend agreement after during.,2024-10-07 09:42:59
1077,662,80,4,2024-03-18 20:05:35,Trial outside budget sign remember star believe month health.,2024-03-18 20:05:35
1078,245,517,2,2025-01-01 01:34:59,So bad professional Republican before want ability forward society fund truth understand.,2025-01-01 01:34:59
1079,994,599,5,2024-07-30 15:50:38,Meeting majority place man challenge everything person add tell place.,2024-07-30 15:50:38
1080,604,545,3,2025-04-30 15:46:20,Quickly hotel ten production language but high hospital discussion tree place.,2025-04-30 15:46:20
1081,708,517,3,2024-12-01 12:45:52,Fast threat make agree international everyone long fine discussion use guess.,2024-12-01 12:45:52
1082,34,593,2,2025-09-06 12:49:55,Explain store financial available agree perhaps rule fact professional.,2025-09-06 12:49:55
1083,6,439,2,2025-01-12 01:12:54,Key machine nation well expert star administration.,2025-01-12 01:12:54
1084,632,62,5,2024-09-17 03:48:34,Note everybody instead nature Mrs cup school job goal example stuff very any.,2024-09-17 03:48:34
1085,532,373,5,2025-04-20 00:44:04,According name page human make discussion control.,2025-04-20 00:44:04
1086,649,307,1,2024-10-13 00:42:26,Live teacher nothing authority provide late term through collection fine defense involve per.,2024-10-13 00:42:26
1087,265,378,2,2024-08-02 12:43:58,Give call follow work hear then decision leave trial meeting start.,2024-08-02 12:43:58
1088,177,70,1,2024-09-12 15:26:02,Nature ball social occur college discussion election.,2024-09-12 15:26:02
1089,335,24,2,2024-12-21 00:09:01,Sea south mention party remember month risk military.,2024-12-21 00:09:01
1090,35,67,2,2024-05-23 00:09:54,Security must station media protect inside side skill loss kid.,2024-05-23 00:09:54
1091,487,332,1,2025-01-02 09:27:16,Agency energy fight their huge in score teach same person where theory.,2025-01-02 09:27:16
1092,285,208,1,2024-08-17 20:43:37,Decide improve offer skin major specific election fight.,2024-08-17 20:43:37
1093,592,260,3,2025-01-04 15:04:03,Back however front without trial south including attorney day.,2025-01-04 15:04:03
1094,529,396,1,2024-11-10 07:29:16,Agreement process talk simply your dinner.,2024-11-10 07:29:16
1095,581,252,1,2025-08-20 19:03:07,Upon message each range institution than draw.,2025-08-20 19:03:07
1096,65,575,5,2025-06-14 11:16:18,Change group family notice individual fight during also establish onto send travel medical.,2025-06-14 11:16:18
1097,188,470,2,2025-06-10 22:19:34,Top deep each beat easy many down learn.,2025-06-10 22:19:34
1098,849,534,5,2024-07-02 03:37:36,Statement world number event key take.,2024-07-02 03:37:36
1099,553,589,4,2024-08-29 21:15:20,Training final still under fish grow east heart be unit us especially positive.,2024-08-29 21:15:20
1100,979,179,3,2024-05-14 11:57:14,Doctor successful campaign hundred line time job return hit standard.,2024-05-14 11:57:14
1101,678,327,1,2024-03-09 04:42:30,Every clearly you listen trade turn that else window trip state party have.,2024-03-09 04:42:30
1102,396,405,4,2024-06-03 22:52:09,Every front boy thousand maintain young worker position new week.,2024-06-03 22:52:09
1103,999,102,4,2024-06-17 06:23:03,Article human while half scientist also whatever through evidence drug instead beyond others.,2024-06-17 06:23:03
1104,744,163,1,2024-11-24 11:36:43,Third wonder prepare politics financial technology nation majority.,2024-11-24 11:36:43
1105,138,69,4,2024-12-31 03:18:00,Foreign spend manage fact size why the.,2024-12-31 03:18:00
1106,748,454,5,2024-09-04 12:32:12,Feel operation specific fight modern Mr.,2024-09-04 12:32:12
