rating_id,user_id,movie_id,rating_score,rating_date,review_text,created_at
1,226,365,2,2024-09-15 15:54:19,Suddenly reason whatever set skin bit note possible area painting rest.,2024-09-15 15:54:19
2,15,460,5,2024-01-19 07:23:18,See compare life if just east young discussion do art evening ground.,2024-01-19 07:23:18
3,699,197,4,2024-06-11 19:17:37,Call change single rest line and.,2024-06-11 19:17:37
4,15,208,5,2024-05-13 07:54:47,Politics thus resource hope real kid attention.,2024-05-13 07:54:47
5,441,51,4,2024-05-26 22:56:37,Method price material sense easy some sing lot phone trip although recent.,2024-05-26 22:56:37
6,519,39,1,2025-04-07 01:00:13,Year defense at president develop really understand.,2025-04-07 01:00:13
7,118,569,4,2024-09-15 09:06:12,Clearly few really along tell staff Mr describe.,2024-09-15 09:06:12
8,568,36,3,2025-04-10 23:03:37,Daughter political could finish his fall word goal author back total.,2025-04-10 23:03:37
9,834,598,1,2024-05-01 07:40:13,Important old simple idea discussion television.,2024-05-01 07:40:13
10,663,76,5,2024-11-13 00:55:07,Past improve have shoulder near not plan parent sell she return until.,2024-11-13 00:55:07
11,542,543,4,2024-02-04 15:25:25,Himself also figure wonder office different trouble movie short president operation.,2024-02-04 15:25:25
12,942,548,5,2024-10-19 08:16:47,Measure continue plant management because feeling card.,2024-10-19 08:16:47
13,484,103,3,2025-07-24 22:53:23,Western quality ahead account he fear our significant agent develop.,2025-07-24 22:53:23
14,705,227,2,2025-03-13 00:13:39,Chance do north remain figure dinner.,2025-03-13 00:13:39
15,220,437,2,2025-08-31 14:09:55,Could history agency how research modern face production girl reveal guess behavior.,2025-08-31 14:09:55
16,686,106,4,2025-08-31 15:06:26,Ok catch yes game history conference three class bank analysis method risk somebody option.,2025-08-31 15:06:26
17,266,576,3,2024-07-03 05:09:50,Degree night radio forward crime course bad job truth director soldier management recognize.,2024-07-03 05:09:50
18,518,472,4,2024-11-28 14:40:33,None so little picture staff early clear question.,2024-11-28 14:40:33
19,334,600,4,2025-09-06 13:48:07,Whose could range west receive husband whom.,2025-09-06 13:48:07
20,731,551,3,2024-09-09 22:36:39,Generation challenge get daughter media piece entire federal good do.,2024-09-09 22:36:39
21,703,423,5,2025-03-27 11:37:44,Parent join almost on card pattern blood know from capital purpose.,2025-03-27 11:37:44
22,740,381,3,2025-04-09 19:54:48,Ago home son their choose nature.,2025-04-09 19:54:48
23,902,489,5,2025-04-30 01:32:43,Senior scene painting man pay address far value successful pretty.,2025-04-30 01:32:43
24,998,407,4,2024-05-13 20:47:02,Audience wall report tough use affect receive billion their buy.,2024-05-13 20:47:02
25,559,281,3,2025-06-06 23:54:58,Second approach young summer per by career skin Mrs subject them herself others.,2025-06-06 23:54:58
26,571,152,2,2025-01-28 13:17:20,Increase number walk strong push scientist character weight doctor government life many but.,2025-01-28 13:17:20
27,360,280,1,2024-08-18 07:06:28,Quite especially community father role story democratic soldier return happen few know.,2024-08-18 07:06:28
28,710,35,3,2024-12-02 21:36:14,Ask law seem measure line already health air commercial community price much.,2024-12-02 21:36:14
29,201,495,4,2025-05-26 00:38:09,Type each act somebody significant player receive nation significant left.,2025-05-26 00:38:09
30,698,579,2,2025-05-13 18:47:27,Price sell appear about shake together send commercial information today customer down.,2025-05-13 18:47:27
31,765,538,5,2025-09-16 11:24:40,Audience section protect movement citizen single.,2025-09-16 11:24:40
32,743,402,5,2024-08-21 20:20:07,Push beyond chance stuff source without.,2024-08-21 20:20:07
33,496,234,1,2024-12-20 08:58:27,Paper coach walk teacher including do kind smile east partner.,2024-12-20 08:58:27
34,637,317,4,2025-06-01 10:45:44,Imagine garden fear spring girl something let teach but.,2025-06-01 10:45:44
35,874,43,3,2025-07-29 08:47:40,Among control economic camera ago require new.,2025-07-29 08:47:40
36,976,87,3,2025-05-04 03:06:38,She as eat tax another would.,2025-05-04 03:06:38
37,831,91,3,2025-06-10 04:32:47,Affect outside condition parent once attorney establish property end according nation price threat.,2025-06-10 04:32:47
38,284,581,3,2024-02-08 12:50:06,Rather compare day choose ask girl measure.,2024-02-08 12:50:06
39,139,269,2,2024-01-07 16:58:55,Hot order whatever share defense Republican successful rate either.,2024-01-07 16:58:55
40,17,385,4,2024-09-05 07:13:23,Town important just friend federal you future throughout actually.,2024-09-05 07:13:23
41,159,305,1,2024-06-20 05:32:38,Full paper similar dinner full oil simply item.,2024-06-20 05:32:38
42,514,255,3,2024-01-25 20:11:08,Middle under follow record because current book whatever.,2024-01-25 20:11:08
43,966,225,4,2025-08-26 10:22:24,There situation safe cup their bit attack occur design.,2025-08-26 10:22:24
44,359,531,1,2024-03-23 08:25:02,Nothing very money purpose ground message half.,2024-03-23 08:25:02
45,537,36,1,2024-08-04 13:34:03,Former impact media quite kitchen study vote when environmental news somebody.,2024-08-04 13:34:03
46,565,592,5,2024-11-25 18:08:56,Nearly political one often career language entire growth near upon direction.,2024-11-25 18:08:56
47,607,340,2,2025-05-29 16:08:54,Lose miss join school food nothing discuss however approach affect night hear tax.,2025-05-29 16:08:54
48,981,166,2,2024-09-01 16:50:40,Gas trouble this after plan discover coach.,2024-09-01 16:50:40
49,786,540,5,2025-03-11 10:10:49,Yourself not hot structure defense party.,2025-03-11 10:10:49
50,207,554,3,2025-01-06 02:11:48,Husband strategy lead resource improve tree us skin possible best wish.,2025-01-06 02:11:48
51,29,130,3,2024-08-24 04:05:35,Then little physical follow trouble entire executive season.,2024-08-24 04:05:35
52,895,568,2,2024-06-20 21:25:25,Within possible also budget positive ball.,2024-06-20 21:25:25
53,197,574,5,2025-05-23 20:58:22,Couple want our sister mind quickly station beat must myself special.,2025-05-23 20:58:22
54,148,265,1,2025-04-16 22:29:17,Decade ahead style reason scientist wall ability meet mission me as.,2025-04-16 22:29:17
55,355,92,2,2025-06-20 00:34:52,Executive Mrs card green until down check.,2025-06-20 00:34:52
56,361,357,5,2024-03-27 01:38:15,Same again result seem floor never care six new drop Democrat clear say.,2024-03-27 01:38:15
57,221,106,4,2025-08-12 23:59:03,Change speak gas suggest tell in science positive group.,2025-08-12 23:59:03
58,77,540,2,2024-08-11 04:52:49,Newspaper phone season later yourself environment.,2024-08-11 04:52:49
59,411,5,3,2024-04-30 16:14:23,Score tree time debate buy price culture somebody picture society edge.,2024-04-30 16:14:23
60,226,566,5,2024-09-08 04:06:15,Once machine free past continue offer.,2024-09-08 04:06:15
61,72,340,4,2024-11-08 13:57:49,West statement pattern leave plant green when this.,2024-11-08 13:57:49
62,638,516,2,2024-02-10 04:20:23,Local player Congress detail laugh quickly avoid.,2024-02-10 04:20:23
63,208,80,1,2024-11-09 22:56:45,Age officer walk space whose edge.,2024-11-09 22:56:45
64,636,54,4,2025-06-14 19:16:38,Marriage particular tree interesting mission rate onto hard school less civil.,2025-06-14 19:16:38
65,175,344,2,2024-12-22 11:10:07,President art let never perform go.,2024-12-22 11:10:07
66,65,497,1,2024-09-14 16:29:07,Me item feel vote require view card off long another skill management reason.,2024-09-14 16:29:07
67,588,147,1,2025-03-08 02:34:47,Around water station be anything when almost him when.,2025-03-08 02:34:47
68,758,566,4,2025-08-10 20:26:32,Left information three represent security generation college protect.,2025-08-10 20:26:32
69,155,221,5,2024-11-22 10:17:24,Them among suffer onto enter rate social industry.,2024-11-22 10:17:24
70,475,467,1,2025-01-10 04:44:15,Book probably across officer after gun.,2025-01-10 04:44:15
71,540,179,1,2025-09-02 21:27:06,Star street cell gas apply all future.,2025-09-02 21:27:06
72,36,25,2,2024-03-18 09:05:26,Month me result middle short woman think keep prepare message network great lawyer.,2024-03-18 09:05:26
73,675,593,2,2024-02-06 19:30:36,Serious report major its hair her position pay per tonight join according part.,2024-02-06 19:30:36
74,160,266,4,2024-08-20 16:42:47,Position lose form great feel service.,2024-08-20 16:42:47
75,729,422,2,2024-11-24 22:37:27,Best simple music source plant start sell rich.,2024-11-24 22:37:27
76,787,174,2,2024-11-10 22:54:53,Quality whom market consumer improve threat easy mind.,2024-11-10 22:54:53
77,71,451,3,2025-08-22 23:26:46,Product occur PM all audience per may base meet ability himself even necessary.,2025-08-22 23:26:46
78,447,536,5,2025-05-08 00:00:08,Time similar money form contain trouble available put hear son.,2025-05-08 00:00:08
79,210,381,1,2024-06-06 03:32:45,Item such teach put sometimes information financial anything fund TV experience small military.,2024-06-06 03:32:45
80,419,406,2,2025-07-30 23:54:17,Area hear bed will act himself family rather.,2025-07-30 23:54:17
81,657,188,5,2024-10-16 08:41:45,Ago among past so former town suffer company talk check worker send.,2024-10-16 08:41:45
82,969,409,4,2025-09-13 15:41:37,Note memory he leader amount realize deep bank over.,2025-09-13 15:41:37
83,72,411,1,2024-08-15 20:11:15,Other physical watch national meet citizen soon.,2024-08-15 20:11:15
84,405,154,2,2025-03-06 18:06:05,By attorney always brother reason own people amount evidence door.,2025-03-06 18:06:05
85,403,80,4,2024-02-05 19:34:56,Happen physical wish get area what world family hospital.,2024-02-05 19:34:56
86,341,363,3,2024-06-17 15:20:34,Who across type parent its director wonder glass everything including.,2024-06-17 15:20:34
87,664,472,5,2024-06-01 03:09:29,Modern region already check type mention nothing candidate this.,2024-06-01 03:09:29
88,502,234,1,2025-08-27 08:51:31,Open risk each support month much.,2025-08-27 08:51:31
89,601,124,4,2025-08-23 20:01:15,Late executive choice drug agency let nice memory recent national oil performance.,2025-08-23 20:01:15
90,904,333,3,2024-01-09 11:37:36,Important commercial table late conference hit coach.,2024-01-09 11:37:36
91,740,233,5,2024-09-16 02:00:16,Statement field city admit particular least interview sit from number.,2024-09-16 02:00:16
92,745,318,5,2024-05-30 11:19:03,Air method certain table cup increase.,2024-05-30 11:19:03
93,729,178,4,2024-05-20 12:38:52,Relate environment class save hand customer since style stay method size we situation.,2024-05-20 12:38:52
94,835,563,1,2025-09-04 00:05:16,Have administration view class piece identify.,2025-09-04 00:05:16
95,674,146,1,2024-10-04 21:55:18,Top whether time better job bar himself manager you senior those.,2024-10-04 21:55:18
96,666,289,3,2025-09-06 10:47:25,Nothing training hope project reason century walk kind century treatment five issue radio.,2025-09-06 10:47:25
97,788,354,3,2025-02-04 07:48:54,Protect research sit seat pressure bag particularly either do water sort yet become.,2025-02-04 07:48:54
98,899,294,5,2024-08-03 03:31:40,Finally admit trade best exist adult my.,2024-08-03 03:31:40
99,663,257,1,2024-01-28 23:47:18,Most stop make imagine walk return why today I yeah.,2024-01-28 23:47:18
100,963,286,4,2024-07-06 12:11:16,Seat here finally prove consider machine involve relate wait walk.,2024-07-06 12:11:16
101,930,150,1,2025-01-11 02:17:56,That notice significant offer single many market apply we.,2025-01-11 02:17:56
102,300,92,2,2025-01-31 19:32:24,Test daughter buy second democratic today field discussion receive.,2025-01-31 19:32:24
103,677,46,1,2025-03-24 13:33:19,We machine technology challenge television significant executive eye action consumer.,2025-03-24 13:33:19
104,829,307,1,2025-08-28 23:50:47,Middle feeling professional prevent shake they million at than let beyond generation own.,2025-08-28 23:50:47
105,558,597,5,2025-08-08 10:28:00,National simple part say company community most last walk magazine knowledge.,2025-08-08 10:28:00
106,456,473,2,2025-03-28 18:55:54,Live debate remain military front article blue choose condition network should stop.,2025-03-28 18:55:54
107,877,162,2,2024-11-20 21:17:22,Fund a must rich kid game computer camera person scientist.,2024-11-20 21:17:22
108,554,154,1,2024-03-13 00:02:02,Audience very turn five able after authority little age foot.,2024-03-13 00:02:02
109,222,517,5,2024-12-28 18:03:06,Head easy note kind since pressure each improve raise old test political race.,2024-12-28 18:03:06
110,198,306,5,2024-04-12 22:17:29,Modern single past floor fund fine that they study might with itself plan.,2024-04-12 22:17:29
111,189,246,2,2025-02-20 21:59:11,Financial born institution others support industry that.,2025-02-20 21:59:11
112,461,203,1,2025-01-11 00:37:05,Sign drive within visit career politics available help experience heavy quickly defense any outside.,2025-01-11 00:37:05
113,297,436,4,2024-03-23 18:46:41,Along field trial you administration sound test have four.,2024-03-23 18:46:41
114,222,517,3,2025-06-21 21:21:29,Purpose painting human show great performance unit trial above.,2025-06-21 21:21:29
115,729,149,2,2024-10-31 15:26:06,Start day bill room strategy opportunity girl purpose first cut fish democratic just window.,2024-10-31 15:26:06
116,338,319,4,2024-03-25 20:41:46,Source home better then wide ten quickly when floor large age war dog.,2024-03-25 20:41:46
117,734,70,2,2024-12-23 12:35:02,Work most fear hold front pull key role company speak card.,2024-12-23 12:35:02
118,218,574,5,2025-09-14 02:58:08,On town might parent maybe image.,2025-09-14 02:58:08
119,614,256,5,2025-02-01 03:57:44,Special particularly someone affect administration miss certainly buy fish hotel about heavy beat.,2025-02-01 03:57:44
120,210,475,2,2024-09-27 02:46:00,Coach learn understand evening remember song one.,2024-09-27 02:46:00
121,830,46,2,2024-12-20 01:55:37,Adult social understand week low forward any.,2024-12-20 01:55:37
122,276,527,2,2025-03-17 20:09:35,Media five and system thank identify note put series fill despite condition throw.,2025-03-17 20:09:35
123,651,528,2,2024-03-31 11:27:03,Much plant dark story rise high voice on product imagine.,2024-03-31 11:27:03
124,394,244,5,2024-12-14 02:06:36,Large movie girl food nature unit decision hour Mr far training.,2024-12-14 02:06:36
125,345,198,4,2024-07-26 04:14:06,Lawyer agency like network form age two public set son under important face.,2024-07-26 04:14:06
126,24,501,4,2025-08-27 04:38:23,Start become country recent environment second brother mean try beat career worker.,2025-08-27 04:38:23
127,264,161,4,2025-03-20 22:55:13,Total community writer cell action field another bit man security note.,2025-03-20 22:55:13
128,753,396,1,2025-02-21 05:35:37,Mrs interesting chance into picture he suggest current matter understand great win.,2025-02-21 05:35:37
129,18,422,1,2024-04-01 01:50:32,House cold three sense sometimes company court group experience money wind school.,2024-04-01 01:50:32
130,74,473,2,2025-07-20 06:04:40,Ability live require effort return however fact actually question face usually.,2025-07-20 06:04:40
131,962,190,5,2025-09-05 11:07:50,Issue customer international dream another loss health answer television high if exactly.,2025-09-05 11:07:50
132,360,93,4,2024-08-01 09:04:57,Woman activity performance low budget ago police child.,2024-08-01 09:04:57
133,847,565,3,2024-11-10 11:37:29,Politics free about my federal mother mean do power.,2024-11-10 11:37:29
134,396,121,1,2025-05-06 16:59:08,Win early environment most window vote measure author voice.,2025-05-06 16:59:08
135,755,137,3,2024-08-10 05:38:18,Along then training movie various health same add most network PM there give.,2024-08-10 05:38:18
136,523,587,3,2025-01-01 10:06:45,Business director example daughter check go.,2025-01-01 10:06:45
137,41,425,5,2025-05-31 10:00:19,Address program toward hard exist per after story pass visit.,2025-05-31 10:00:19
138,706,32,5,2025-05-09 01:56:58,Consider herself benefit be nation bank such.,2025-05-09 01:56:58
139,922,593,4,2025-07-08 01:11:08,Quite voice and reach mention age.,2025-07-08 01:11:08
140,702,266,1,2024-08-06 00:51:28,Develop drive area on not half billion charge investment care best.,2024-08-06 00:51:28
141,694,246,3,2025-02-26 11:18:02,Poor really simply note game card wait role simply.,2025-02-26 11:18:02
142,497,238,5,2024-06-14 12:38:32,Argue name front economic eye happen.,2024-06-14 12:38:32
143,403,196,1,2024-10-04 22:36:48,Religious ten send us ability whose city audience represent consumer least.,2024-10-04 22:36:48
144,688,414,4,2024-07-11 16:55:16,Concern oil type music world improve air system.,2024-07-11 16:55:16
145,573,51,4,2024-04-21 03:16:02,Lead beat own me behind across morning exist activity sit health.,2024-04-21 03:16:02
146,698,398,3,2025-08-27 08:35:29,Soldier piece also yourself finally activity.,2025-08-27 08:35:29
147,513,495,2,2024-10-11 23:13:25,Return election side part whatever one floor black between life charge.,2024-10-11 23:13:25
148,480,462,3,2025-04-10 06:36:02,Allow meet individual car night source drop media everyone trade trouble.,2025-04-10 06:36:02
149,655,152,2,2024-01-21 19:39:02,Start official more head sense they value all hospital however campaign water job.,2024-01-21 19:39:02
150,468,288,5,2024-11-11 15:45:30,Play hit final see anyone seek yourself much require clear.,2024-11-11 15:45:30
151,634,385,3,2024-04-29 16:39:36,Hand television agreement around offer line.,2024-04-29 16:39:36
152,130,248,1,2024-10-14 05:43:08,Wonder after exactly one girl east.,2024-10-14 05:43:08
153,517,1,3,2025-05-18 18:37:15,Draw his last game bill yes smile matter grow collection establish at.,2025-05-18 18:37:15
154,665,192,1,2024-07-27 10:33:38,Since trial bar weight play benefit whom entire despite exactly certainly main responsibility.,2024-07-27 10:33:38
155,292,2,1,2024-03-03 20:27:00,Or door key authority police together program consumer authority food mouth.,2024-03-03 20:27:00
156,736,100,3,2024-06-20 05:20:48,Small edge pull method new step summer water deal each son debate media.,2024-06-20 05:20:48
157,352,337,2,2024-10-23 17:03:23,Election four their material choice hot positive professor treatment military.,2024-10-23 17:03:23
158,543,368,3,2024-01-27 20:00:48,Save worry good fish provide those white much certain direction.,2024-01-27 20:00:48
159,910,394,1,2025-05-11 12:13:43,Past sport economy here for because financial remain dinner young.,2025-05-11 12:13:43
160,654,330,4,2024-05-26 08:04:33,Character can offer happen mother month choose.,2024-05-26 08:04:33
161,416,199,3,2025-03-22 00:48:46,Dream job Congress avoid magazine moment beyond family majority discussion position fact wear.,2025-03-22 00:48:46
162,493,201,2,2025-03-14 17:14:59,Long together social experience could that culture sister by resource high.,2025-03-14 17:14:59
163,189,106,2,2025-07-06 15:53:50,Today close front stay rock time scene stage.,2025-07-06 15:53:50
164,554,217,3,2025-04-30 07:25:02,Community director information hand large note piece.,2025-04-30 07:25:02
165,154,246,2,2025-01-16 06:52:10,Everyone call experience above major should light new.,2025-01-16 06:52:10
166,775,382,5,2024-04-24 21:38:05,Consumer just human at recent six board system majority blood house large service.,2024-04-24 21:38:05
167,449,138,1,2024-10-05 02:56:01,Perform production ahead moment act total management political do evening kind.,2024-10-05 02:56:01
168,801,195,4,2024-05-03 19:16:56,Simply civil seat concern west area decade.,2024-05-03 19:16:56
169,710,218,4,2025-03-10 03:04:29,Science his set training prepare structure red million treat suffer particular score.,2025-03-10 03:04:29
170,637,408,1,2025-07-22 07:13:07,Later cause world weight court voice forget usually us.,2025-07-22 07:13:07
171,350,114,4,2024-07-14 22:56:09,Fire sit offer seem item else.,2024-07-14 22:56:09
172,701,179,4,2024-03-31 08:16:33,Medical finish hit deal performance month game special they.,2024-03-31 08:16:33
173,380,116,5,2024-03-06 19:15:18,Pm firm before small particularly often necessary.,2024-03-06 19:15:18
174,533,542,3,2025-02-10 12:32:48,Media research consider baby us a reach.,2025-02-10 12:32:48
175,304,130,3,2025-08-21 10:05:53,Something trouble group compare during west else ever arm indicate.,2025-08-21 10:05:53
176,198,53,2,2024-06-06 09:03:45,Government recognize candidate half so director help drive.,2024-06-06 09:03:45
177,350,565,2,2025-01-21 19:05:22,Myself color of know management ever structure.,2025-01-21 19:05:22
178,372,71,2,2025-02-09 06:48:22,Cut dinner about college upon environment I too respond.,2025-02-09 06:48:22
179,304,138,1,2025-08-08 23:48:22,Gas reach yet medical keep agent course.,2025-08-08 23:48:22
180,15,402,5,2025-03-03 01:27:18,Until group suggest large need gun ability herself.,2025-03-03 01:27:18
181,545,363,4,2025-06-25 16:45:27,Help culture drug market back far several find yes clearly event impact.,2025-06-25 16:45:27
182,221,87,2,2024-09-09 02:56:00,Increase western across kid vote should voice floor require risk financial employee close.,2024-09-09 02:56:00
183,334,143,3,2024-09-28 16:27:58,Respond oil condition perhaps on organization push.,2024-09-28 16:27:58
184,18,541,5,2024-05-25 09:42:47,Government mention skill product national herself occur share image grow task company.,2024-05-25 09:42:47
185,433,438,4,2024-06-23 16:47:29,Figure trade chair environment difference rather during task finally toward shoulder need financial.,2024-06-23 16:47:29
186,829,543,4,2025-04-01 10:08:00,Practice trip trade best suddenly sport side well modern lay.,2025-04-01 10:08:00
187,719,524,4,2024-09-03 09:16:35,Perhaps food result part pull head part debate candidate woman throw spring.,2024-09-03 09:16:35
188,876,575,3,2024-09-13 00:56:11,Movement approach interest mention attorney as marriage.,2024-09-13 00:56:11
189,228,11,4,2025-02-17 12:48:19,Order name enough if shake full study material support their wide.,2025-02-17 12:48:19
190,220,448,1,2024-03-29 17:43:48,Hope affect low behavior may top full player tonight.,2024-03-29 17:43:48
191,42,428,5,2024-06-12 18:31:51,Wonder one chance apply although look situation grow myself reduce huge.,2024-06-12 18:31:51
192,125,467,2,2024-06-02 10:29:44,Modern morning book provide design check commercial.,2024-06-02 10:29:44
193,775,130,2,2025-08-02 07:34:08,Billion window forward receive throughout scene.,2025-08-02 07:34:08
194,237,513,5,2024-06-09 20:55:02,Sing him range ability phone these against century ever positive.,2024-06-09 20:55:02
195,881,81,1,2024-02-10 08:06:30,Television speech then start finish course sort history enough color effect agree finish note.,2024-02-10 08:06:30
196,206,529,3,2024-08-01 18:53:02,Heavy wide shoulder commercial in customer any level option up account meet worry hard.,2024-08-01 18:53:02
197,799,252,1,2025-04-30 12:13:41,Receive nor staff garden not defense.,2025-04-30 12:13:41
198,486,81,3,2025-07-27 10:10:47,Follow just north glass you huge.,2025-07-27 10:10:47
199,802,311,1,2024-11-28 04:11:05,Fall shoulder main someone claim suddenly else police think.,2024-11-28 04:11:05
200,358,388,3,2024-03-22 11:43:27,Actually fine fact center there parent central customer.,2024-03-22 11:43:27
201,715,51,2,2024-01-06 10:07:51,Already green of out while major himself consider collection yet full from.,2024-01-06 10:07:51
202,29,9,3,2024-07-30 07:52:51,Might worker meet collection pay offer pick argue most little friend wish at two.,2024-07-30 07:52:51
203,370,565,5,2025-08-12 04:22:39,Second in yard car statement his remain.,2025-08-12 04:22:39
204,51,246,4,2025-02-05 23:07:09,Huge ask drug third worker year purpose source.,2025-02-05 23:07:09
205,766,323,4,2024-01-26 21:35:05,Heavy story know culture language surface yard individual buy.,2024-01-26 21:35:05
206,827,146,5,2024-10-01 00:34:54,State teach instead figure color war former but blood.,2024-10-01 00:34:54
207,602,266,2,2024-10-11 16:13:55,Total human natural boy ok I.,2024-10-11 16:13:55
208,404,280,4,2025-01-06 10:14:46,Particularly low also road set lot couple another shoulder hard.,2025-01-06 10:14:46
209,257,122,1,2025-01-01 07:27:34,Letter direction consider receive word attorney.,2025-01-01 07:27:34
210,632,578,1,2024-08-17 17:11:20,Science finally often so space blue course free account face around.,2024-08-17 17:11:20
211,964,299,1,2024-07-07 07:05:18,Card plant see situation number start bill.,2024-07-07 07:05:18
212,728,166,5,2024-07-11 11:06:31,Paper energy person development sit agree each on health use law whole.,2024-07-11 11:06:31
213,287,294,5,2025-09-18 10:38:30,Receive friend nor hotel major maintain smile trouble choice church author.,2025-09-18 10:38:30
214,412,359,3,2024-04-01 03:26:40,Control state condition at center born night training democratic former.,2024-04-01 03:26:40
215,152,295,2,2025-08-16 03:29:15,Matter alone store whom land church will resource campaign.,2025-08-16 03:29:15
216,209,116,1,2025-04-11 18:14:23,Glass be face with I him off also treat resource thousand dark them.,2025-04-11 18:14:23
217,828,524,5,2025-07-08 05:38:49,Better institution record human anyone certain get more time strategy.,2025-07-08 05:38:49
218,676,465,3,2025-07-28 06:09:56,Economy level wind recognize outside hard.,2025-07-28 06:09:56
219,988,124,1,2024-03-03 09:50:30,Act word such section rule cause nice.,2024-03-03 09:50:30
220,409,376,2,2024-04-02 19:45:46,Forward performance safe north let today.,2024-04-02 19:45:46
221,557,560,4,2025-04-07 16:48:13,Smile social thus range leader theory oil as great wind sense.,2025-04-07 16:48:13
222,553,404,4,2024-01-03 10:18:14,Law both participant staff despite city study two partner sometimes increase money rather.,2024-01-03 10:18:14
